QuestionLink,Title,Score,Tags,
"https://stackoverflow.com/questions/72503769","Is there a Tensorflow function for finding the indices next to a condition?","1","<python><tensorflow><indexing>","tensorflow"
"https://stackoverflow.com/questions/68741326","Sagemaker Instance not utilising GPU during training","1","<python-3.x><amazon-web-services><machine-learning><tensorflow2.0><amazon-sagemaker>","tensorflow"
"https://stackoverflow.com/questions/70054095","Explanation of parameters of Tflite.runModelOnImage","1","<tensorflow><tensorflow-lite>","tensorflow"
"https://stackoverflow.com/questions/68550779","Slicing a 2D tensor similar to numpy np.ix_","1","<python><tensorflow>","tensorflow"
"https://stackoverflow.com/questions/72505074","Out of memory Error while training Rasa/LaBSE","1","<python><tensorflow><rasa><rasa-nlu><rasa-sdk>","tensorflow"
"https://stackoverflow.com/questions/66889953","Apply affine transformations to images in TensorFlow2","1","<python><image><tensorflow><tensorflow2.0><affinetransform>","tensorflow"
"https://stackoverflow.com/questions/66413948","Per example clipping in TensorFlow Federated with DP-FedAvg","1","<tensorflow><tensorflow2.0><tensorflow-federated>","tensorflow"
"https://stackoverflow.com/questions/66857077","using tfds for using my custom dataset with tensorflow fails","1","<python><tensorflow><command-line><dataset><tensorflow-datasets>","tensorflow"
"https://stackoverflow.com/questions/73044896","Concatenate multiple from_tensor_slices() Datasets","1","<python><tensorflow>","tensorflow"
"https://stackoverflow.com/questions/66902427","Random integer inside tensorflow function","1","<python><tensorflow>","tensorflow"
"https://stackoverflow.com/questions/69896247","Google Cloud Deep Learning On Linux VM throws Unknown Cuda Error","1","<tensorflow><google-cloud-platform><deep-learning><gpu><nvidia>","tensorflow"
"https://stackoverflow.com/questions/66874943","Why iterations over the same tf.data.Dataset give different data each iteration?","1","<python><tensorflow><tensorflow-datasets>","tensorflow"
"https://stackoverflow.com/questions/73044902","What is the difference between tf.Tensor( and <tf.Tensor: >","1","<python><tensorflow><variables><tensorflow2.0><tensorflow-datasets>","tensorflow"
"https://stackoverflow.com/questions/66932204","tflite_runtime get Illegal instruction on raspberry pi","1","<linux><tensorflow><raspberry-pi><tensorflow-lite>","tensorflow"
"https://stackoverflow.com/questions/65985137","Convert to numpy a tensor without eager mode","1","<python><numpy><tensorflow><neural-network><eager-execution>","tensorflow"
"https://stackoverflow.com/questions/66889296","GPflow 2 custom kernel construction: fine upon construction, but kernel of size None in optimization","1","<python><tensorflow><gpflow><gaussian-process>","tensorflow"
"https://stackoverflow.com/questions/73099147","Tensorflow gather, concatenate and then pad operation?","1","<python><tensorflow><tensorflow2.0><tensor><ragged>","tensorflow"
"https://stackoverflow.com/questions/67006742","TTS not working in tensorflow for gesture detection android app","1","<java><android><tensorflow><text-to-speech><gesture-recognition>","tensorflow"
"https://stackoverflow.com/questions/66492269","Why is training loss oscilating up and down?","1","<python><tensorflow><object-detection><object-detection-api><efficientnet>","tensorflow"
"https://stackoverflow.com/questions/66899783","Tensorflow distributed training hangs with RecvTensor cancelled warning","1","<python><tensorflow><distributed>","tensorflow"
"https://stackoverflow.com/questions/73148372","Training my Spacy Models gives ""Could not load dynamic library 'libcudart.so.11.0'"" but continues anyways","1","<python><tensorflow><pip><spacy>","tensorflow"
"https://stackoverflow.com/questions/67602835","Writing custom InstantLayerNormalization in tensorflow js","1","<javascript><tensorflow><machine-learning><tensorflow.js>","tensorflow"
"https://stackoverflow.com/questions/66351437","Exporting fine-tuned saved model to TensorFlow Lite error","1","<tensorflow><tensorflow2.0><tensorflow-lite><object-detection-api>","tensorflow"
"https://stackoverflow.com/questions/66906422","Unable to create a version in Cloud AI Platform using custom containers for prediction","1","<docker><tensorflow><google-cloud-platform><tensorflow-serving><google-cloud-ml>","tensorflow"
"https://stackoverflow.com/questions/73150586","TensorFlow: apply convolutions along one specific axis","1","<python><tensorflow>","tensorflow"
"https://stackoverflow.com/questions/67623823","ValueError: Failed to convert a NumPy array to a Tensor (Unsupported object type list)","1","<python><numpy><tensorflow><chatbot><valueerror>","tensorflow"
"https://stackoverflow.com/questions/66359380","Object Detection (coco-ssd) Node.js: Error: pixels passed to tf.browser.fromPixels() must be either an HTMLVideoElement","1","<javascript><node.js><tensorflow><coco>","tensorflow"
"https://stackoverflow.com/questions/65983087","The most robust way to work with the specific version of Tensorflow with GPU support","1","<python><docker><tensorflow>","tensorflow"
"https://stackoverflow.com/questions/73193605","Adam Optimizer Not Working on cost function","1","<python><tensorflow><deep-learning><neural-network>","tensorflow"
"https://stackoverflow.com/questions/67651749","Unable to get log_prob from a TransformedDistribution in tensorflow","1","<tensorflow><tensorflow-probability>","tensorflow"
"https://stackoverflow.com/questions/70746137","Adapt a numerical tensorflow dataset as a textvector","1","<python><tensorflow><tensorflow2.0><tensorflow-datasets>","tensorflow"
"https://stackoverflow.com/questions/66028728","Tensorflow-GPU will not run GPU","1","<python><tensorflow>","tensorflow"
"https://stackoverflow.com/questions/73194577","Generalised inner product in TensorFlow","1","<python><performance><tensorflow>","tensorflow"
"https://stackoverflow.com/questions/67687683","Vectorised assignment to tensor","1","<python><numpy><tensorflow>","tensorflow"
"https://stackoverflow.com/questions/66027353","Tensorflow on Python 64bit version not working","1","<python><tensorflow>","tensorflow"
"https://stackoverflow.com/questions/66036272","Predicting in parallel using concurrent.futures of tensorflow.keras models","1","<python><tensorflow><parallel-processing><neural-network><concurrent.futures>","tensorflow"
"https://stackoverflow.com/questions/73252119","CommandNotFoundError: Your shell has not been properly configured to use 'conda activate'. Mac M1 Apple Silicon Miniforge","1","<python><tensorflow><conda>","tensorflow"
"https://stackoverflow.com/questions/63286586","Tensorflow probability - Bijector training","1","<python><tensorflow><tensorflow-probability>","tensorflow"
"https://stackoverflow.com/questions/66020046","Calculating Hessian with tensorflow gradient tape","1","<tensorflow><autodiff>","tensorflow"
"https://stackoverflow.com/questions/66062501","Tensorflow tf.function conditionals","1","<python><tensorflow>","tensorflow"
"https://stackoverflow.com/questions/73386663","Tensorflow C api ""Error: Container localhost does not exist.""","1","<c><tensorflow>","tensorflow"
"https://stackoverflow.com/questions/68788593","Apply Tensorflow tf.keras.initializers.GlorotNormal(seed=1) to tf.Variable","1","<python><tensorflow><deep-learning>","tensorflow"
"https://stackoverflow.com/questions/66688358","Not able to use Embedding Layer with tf.distribute.MirroredStrategy","1","<python><tensorflow><tensorflow2.0><multi-gpu>","tensorflow"
"https://stackoverflow.com/questions/66236438","Gradient are None for sliced input in TensorFlow","1","<python><tensorflow><machine-learning><deep-learning><gradienttape>","tensorflow"
"https://stackoverflow.com/questions/73444621","padding one numpy array to achieve the same number os columns of another numpy array","1","<python><arrays><numpy><tensorflow><padding>","tensorflow"
"https://stackoverflow.com/questions/66969532","Why is call called twice during model.fit","1","<tensorflow>","tensorflow"
"https://stackoverflow.com/questions/67487994","calculate original sequence length in padded embedding lookup of a sentence in tensorflow 2.0","1","<python><tensorflow><tensorflow2.0>","tensorflow"
"https://stackoverflow.com/questions/66253342","TypeError: float() argument must be a string or a number, not 'Tensor'","1","<python><tensorflow>","tensorflow"
"https://stackoverflow.com/questions/73450660","Properly splitting YOLO3 model output name to obtain 3 variables and get the best model","1","<python><regex><tensorflow><machine-learning><split>","tensorflow"
"https://stackoverflow.com/questions/67735216","After using pip, I get the error ""Scikit-learn has not been built correctly""","1","<python><python-3.x><tensorflow><scikit-learn>","tensorflow"
"https://stackoverflow.com/questions/68531589","Cross-compiling Coqui + TFLite for armv7ahf in Yocto: R_ARM_TLS_LE32 relocation not permitted in shared object","1","<tensorflow><eigen><yocto><bazel><coqui>","tensorflow"
"https://stackoverflow.com/questions/66299949","TFLite: Micro mutable Op Resolver does not name a type","1","<tensorflow><arduino><arduino-nano>","tensorflow"
"https://stackoverflow.com/questions/73509416","I wanted to convert image to tensors which I'm not able to do","1","<python><python-3.x><tensorflow>","tensorflow"
"https://stackoverflow.com/questions/63315923","Multilayer LSTM without tf.contrib.rnn.MultiRNNCell","1","<tensorflow><neural-network><lstm>","tensorflow"
"https://stackoverflow.com/questions/66900639","Tensorflow stuck on first epoch","1","<python><tensorflow><anaconda><gpu><conda>","tensorflow"
"https://stackoverflow.com/questions/66321592","Is there a way to detect if experimental_compile is True from inside a function","1","<python><tensorflow>","tensorflow"
"https://stackoverflow.com/questions/73509663","What are the strictly required (bare minimum) libraries/packages to run machine learning with GPU in python3","1","<python-3.x><tensorflow><nvidia><miniconda><cudnn>","tensorflow"
"https://stackoverflow.com/questions/63226613","Running out of memory on Deep Neural Network","1","<python><tensorflow><memory><dataset><data-science>","tensorflow"
"https://stackoverflow.com/questions/66919907","Issue: tf.function raising a warning and failing with tf.stack","1","<tensorflow><tensorflow2.0>","tensorflow"
"https://stackoverflow.com/questions/66695848","KFold cross validation in Tensorflow","1","<python><tensorflow><machine-learning><deep-learning><k-fold>","tensorflow"
"https://stackoverflow.com/questions/73519395","Applying tf.math.argmax on list of tensors","1","<python><list><tensorflow>","tensorflow"
"https://stackoverflow.com/questions/62931711","Flipping tensor and fill with zeros in tensorflow","1","<python><numpy><tensorflow><tensor>","tensorflow"
"https://stackoverflow.com/questions/66919946","XOR on tensors (using vectorization) having float value in Tensorflow","1","<python><tensorflow><vectorization><xor><bitwise-xor>","tensorflow"
"https://stackoverflow.com/questions/66496894","TensorFlow predict User's next number","1","<python><tensorflow><machine-learning>","tensorflow"
"https://stackoverflow.com/questions/73631275","Tensorflow js, getting error while using matMul","1","<node.js><tensorflow><tensorflow.js>","tensorflow"
"https://stackoverflow.com/questions/62956096","Is it possible to extract trained class names from tflite model?","1","<tensorflow><raspberry-pi><tensorflow-lite>","tensorflow"
"https://stackoverflow.com/questions/66964000","tensorflow - reason there is no numpy out equivalent parameter","1","<tensorflow>","tensorflow"
"https://stackoverflow.com/questions/70740657","Does optimizer.apply_gradients do gradient descent?","1","<tensorflow><deep-learning><neural-network><tensorflow2.0>","tensorflow"
"https://stackoverflow.com/questions/73635586","Movement multi person pose estimation does not import","1","<python><tensorflow><import><pose>","tensorflow"
"https://stackoverflow.com/questions/70756420","Convert a tensorflow dataset to a python list with strings","1","<python><list><tensorflow><tensorflow2.0><tensorflow-datasets>","tensorflow"
"https://stackoverflow.com/questions/69839295","Which layers are frozen using Tensorflow 2 Object detection API?","1","<tensorflow><object-detection>","tensorflow"
"https://stackoverflow.com/questions/66354417","TFF: What is difference between two type?","1","<tensorflow-federated>","tensorflow"
"https://stackoverflow.com/questions/73727235","Tensorflow js and MacM1","1","<macos><tensorflow><tensorflow.js>","tensorflow"
"https://stackoverflow.com/questions/68541481","Is there any ways to concatenate 3 or more tf.data.Dataset","1","<python><python-3.x><tensorflow><tensorflow2.0>","tensorflow"
"https://stackoverflow.com/questions/66999579","What is the tensorflow equivalent of numpy tuple/array indexing?","1","<tensorflow><matrix-indexing>","tensorflow"
"https://stackoverflow.com/questions/63683573","TensorFlow - Different bit-width quantization between layers","1","<python><tensorflow><tensorflow-lite><quantization>","tensorflow"
"https://stackoverflow.com/questions/63565345","Working of embedding layer in Tensorflow","1","<machine-learning><deep-learning><nlp><tensorflow><python>","tensorflow"
"https://stackoverflow.com/questions/68494971","Tensorflowlite on android buffer size error","1","<android><python-3.x><tensorflow><kotlin><tensorflow-lite>","tensorflow"
"https://stackoverflow.com/questions/69846609","Generate new tensor based on another one and indices of the columns","1","<python><tensorflow>","tensorflow"
"https://stackoverflow.com/questions/63916308","TensorFlow JS - saving min/max values alongside model and loading back in beside prediction data","1","<javascript><json><ajax><tensorflow><machine-learning>","tensorflow"
"https://stackoverflow.com/questions/63692935","Imputing axes by index in Tensorflow","1","<python><tensorflow>","tensorflow"
"https://stackoverflow.com/questions/66310635","Pixel values difference between Tensorflow and skimage","1","<python><tensorflow><tensorflow2.0><scikit-image>","tensorflow"
"https://stackoverflow.com/questions/69855511","Why low mAP on fine-tuned model from Tensorflow 2 Object Detection API?","1","<python><tensorflow><object-detection><object-detection-api>","tensorflow"
"https://stackoverflow.com/questions/63942493","Predict API in Django","1","<python><django><tensorflow-serving>","tensorflow"
"https://stackoverflow.com/questions/63360651","""Tuple indices must be integers or slices, not str"" when loading Tensorflow Dataset","1","<python><tensorflow><machine-learning><neural-network><mnist>","tensorflow"
"https://stackoverflow.com/questions/66672375","TF accuracy score and confusion matrix disagree. Is TensorFlow shuffling data on each access of BatchDataset?","1","<tensorflow><scikit-learn><tensorflow2.0><tensorflow-datasets>","tensorflow"
"https://stackoverflow.com/questions/67655287","Layering softmax classifier into RNN autoencoder","1","<python><tensorflow><neural-network><recurrent-neural-network><autoencoder>","tensorflow"
"https://stackoverflow.com/questions/63962702","Returning arrays of different lengths in a Tensorflow dataset pipeline","1","<python><tensorflow>","tensorflow"
"https://stackoverflow.com/questions/74110017","Read a list of CSV files and make a dataset in tensorflow","1","<python><tensorflow><tensorflow2.0><tensorflow-datasets>","tensorflow"
"https://stackoverflow.com/questions/66746462","ParseError: 172:3 : Message type ""object_detection.protos.TrainConfig"" has no field named ""fine_tune_checkpoint_version""","1","<tensorflow><jupyter-notebook><object-detection><object-detection-api>","tensorflow"
"https://stackoverflow.com/questions/67656969","What does Tensorflow's CyclicalLearningRate scale_fn argument mean?","1","<python><tensorflow><machine-learning><deep-learning>","tensorflow"
"https://stackoverflow.com/questions/63995284","Error using tf.image.decode_image "" b'Unable to decode bytes as JPEG, PNG, GIF, or BMP'""","1","<python><python-3.x><image><tensorflow>","tensorflow"
"https://stackoverflow.com/questions/74182597","For-loop in tf.function returns Tensor(""while/Placeholder:0"", shape=(), dtype=int32)","1","<python><tensorflow><for-loop>","tensorflow"
"https://stackoverflow.com/questions/65632510","Little to No GPU Usage during Custom Object Detection Training After Recent ImageAI Update","1","<python><tensorflow><computer-vision><object-detection><imageai>","tensorflow"
"https://stackoverflow.com/questions/67662727","TFP Linear Regression yhat=model(x_tst) - doesn't work for other data","1","<tensorflow2.0><tensorflow-probability>","tensorflow"
"https://stackoverflow.com/questions/64014730","Ridiculous memory size for dataset array","1","<python-3.x><numpy><dataset><tensorflow2.0>","tensorflow"
"https://stackoverflow.com/questions/74298007","second derivative is None in tensorflow automatic differentiation","1","<python><tensorflow><machine-learning><gradient><automatic-differentiation>","tensorflow"
"https://stackoverflow.com/questions/67439550","Cannot import name 'preprocessing' from 'tensorflow.keras.experimental in tensor flow 2.4.1?","1","<python><tensorflow>","tensorflow"
"https://stackoverflow.com/questions/67668232","Getting same runtime for cpu and gpu on Google Colab","1","<python><tensorflow><google-colaboratory>","tensorflow"
"https://stackoverflow.com/questions/67507110","React Native with TypeScript tfjs-models/universal-sentence-encoder error on model load","1","<typescript><react-native><tensorflow><tensorflow.js>","tensorflow"
"https://stackoverflow.com/questions/74327475","parameters of tf.keras.layers.Rescaling: scale, offset","1","<tensorflow><tensorflow2.0>","tensorflow"
"https://stackoverflow.com/questions/69660201","Inputting some data for BERT model, using tf.data.Dataset.from_tensor_slices","1","<tensorflow><nlp><bert-language-model>","tensorflow"
"https://stackoverflow.com/questions/65167363","Change the dimension of data set from (32,32,3,10000) to (10000,32,32,3) for training the CNN","1","<python><numpy><tensorflow><google-colaboratory><reshape>","tensorflow"
"https://stackoverflow.com/questions/67553616","model.get_weights() vs model.trainable_variables Tensorflow","1","<python><tensorflow><machine-learning><data-science>","tensorflow"
"https://stackoverflow.com/questions/66582866","Combining datasets in a single .npz file","1","<python><python-3.x><numpy><tensorflow>","tensorflow"
"https://stackoverflow.com/questions/69688490","CNN stopped running after I increased the data","1","<python><tensorflow><conv-neural-network>","tensorflow"
"https://stackoverflow.com/questions/68664860","Concatenate multiple convolution blocks: ""A `Concatenate` layer should be called on a list of at least 2 inputs""","1","<python><python-3.x><tensorflow><machine-learning><deep-learning>","tensorflow"
"https://stackoverflow.com/questions/68589991","Why i am getting this problem of zero accuracy when doing gradient boosting?","1","<python><tensorflow><deep-learning><xgboost><multiclass-classification>","tensorflow"
"https://stackoverflow.com/questions/66595724","Segment a region from a numpy array","1","<python><numpy><tensorflow><opencv><computer-vision>","tensorflow"
"https://stackoverflow.com/questions/69713266","performing many gradient-based optimizations in parallel with TensorFlow","1","<python><tensorflow><tensorflow-probability>","tensorflow"
"https://stackoverflow.com/questions/64548889","Load TensorFlow model from .pb file","1","<python><file><tensorflow>","tensorflow"
"https://stackoverflow.com/questions/68602832","Issue with overfitting an ANN -- perhaps due to OneHotEncoder problem","1","<python><tensorflow><scikit-learn>","tensorflow"
"https://stackoverflow.com/questions/63042566","Launching Tensorboard","1","<python><tensorflow><tensorboard>","tensorflow"
"https://stackoverflow.com/questions/69750970","Could not load dynamic library 'libcudnn.so.8'","1","<python><tensorflow><cudnn>","tensorflow"
"https://stackoverflow.com/questions/64568622","'tuple' object has no attribute 'train'","1","<python><tensorflow><machine-learning><deep-learning>","tensorflow"
"https://stackoverflow.com/questions/68904563","Custom Layer not supporting serialized custom activation function","1","<tensorflow><tensorflow2.0>","tensorflow"
"https://stackoverflow.com/questions/67581037","new bug in a variational autoencoder (keras)","1","<python><tensorflow><autoencoder>","tensorflow"
"https://stackoverflow.com/questions/69787543","Custom Loss Function in Keras with Sample Weights","1","<python><tensorflow><loss-function>","tensorflow"
"https://stackoverflow.com/questions/65677710","Tensorflow Apps No Longer Deploying To Heroku: Slug Size Too Large","1","<tensorflow><heroku><streamlit>","tensorflow"
"https://stackoverflow.com/questions/63097531","Can I convert a Numpy ndarray to a Tensor?","1","<python><numpy><tensorflow><multidimensional-array><tensor>","tensorflow"
"https://stackoverflow.com/questions/71330901","Error Running TensorFlow Serving from Dockerfile","1","<docker><tensorflow><tensorflow-serving>","tensorflow"
"https://stackoverflow.com/questions/69815548","Find the max value in tensorflow.python.data.ops.dataset_ops.BatchDataset","1","<python><tensorflow><tensorflow2.0><tensorflow-datasets>","tensorflow"
"https://stackoverflow.com/questions/65684413","Python, Tensorflow ValueError: No gradients provided for any variable","1","<python><tensorflow><gradienttape>","tensorflow"
"https://stackoverflow.com/questions/63099220","Wrong classification with Inceptionv3","1","<tensorflow><machine-learning><artificial-intelligence><classification><conv-neural-network>","tensorflow"
"https://stackoverflow.com/questions/71325581","MediaPipe hands-detection hands.process waits forever","1","<python><numpy><tensorflow><mediapipe>","tensorflow"
"https://stackoverflow.com/questions/70665698","tf.concat fails with type mismatch","1","<python><tensorflow>","tensorflow"
"https://stackoverflow.com/questions/68686314","ImageDataGenerator.flow_from_directory is unable to one-hot encode data","1","<python><tensorflow><deep-learning>","tensorflow"
"https://stackoverflow.com/questions/63338386","Converted ONNX model runs on CPU but not on GPU","1","<python><tensorflow><onnx><onnxruntime>","tensorflow"
"https://stackoverflow.com/questions/72314742","Elegant way to plot average loss of many trains in tensorflow","1","<python><tensorflow>","tensorflow"
"https://stackoverflow.com/questions/70667664","Get output layer Tensorflow 1.14","1","<tensorflow><machine-learning><lstm>","tensorflow"
"https://stackoverflow.com/questions/65732598","using SMOTE with tensorflow's ImageDataGenerator Flow From Directory","1","<tensorflow><imblearn><smote>","tensorflow"
"https://stackoverflow.com/questions/72127376","Reshape tensorflow tensors from feature columns into training samples","1","<python><tensorflow>","tensorflow"
"https://stackoverflow.com/questions/72344302","Trying to create optimizer slot variable under the scope for tf.distribute.Strategy, which is different from the scope used for the original variable","1","<python><tensorflow><dcgan><multiple-gpu>","tensorflow"
"https://stackoverflow.com/questions/70687805","Storing multiple values in a tfrecord feature","1","<python><tensorflow><tensorflow2.0><tensorflow-datasets><tfrecord>","tensorflow"
"https://stackoverflow.com/questions/65705507","Variable value not supported problem, python","1","<python><tensorflow>","tensorflow"
"https://stackoverflow.com/questions/72210060","KeyError: 'NormalizeUTF8' loading a model to another jupyter notebook","1","<tensorflow><jupyter-notebook>","tensorflow"
"https://stackoverflow.com/questions/72355859","Most efficient ways to compare arrays in numpy?","1","<python><numpy><tensorflow><bodypix>","tensorflow"
"https://stackoverflow.com/questions/66350248","Is there any way to inverse tensorflow predicted variable to origin value?","1","<python-3.x><encoding><tensorflow2.0>","tensorflow"
"https://stackoverflow.com/questions/65738721","Setting up Anaconda to use Tensorboard Profiler","1","<python><tensorflow><anaconda><tensorboard>","tensorflow"
"https://stackoverflow.com/questions/72244001","`java.lang.NoSuchMethodError: No static method create` after update tensorflow lite to 0.4.0","1","<android><tensorflow><tensorflow-lite>","tensorflow"
"https://stackoverflow.com/questions/73881400","Convert list of tuples to tensorflow dataset (tf.data.Dataset)","1","<python><tensorflow><tensorflow-datasets><tf.data.dataset>","tensorflow"
"https://stackoverflow.com/questions/66468134","any doable approach to use multiple GPUs, multiple process with tensorflow?","1","<docker><tensorflow><parallel-processing><gpu>","tensorflow"
"https://stackoverflow.com/questions/65745874","tensorflow GPU is not available","1","<python><tensorflow>","tensorflow"
"https://stackoverflow.com/questions/70335600","Why this model can't overfit one example?","1","<tensorflow><deep-learning><overfitting-underfitting>","tensorflow"
"https://stackoverflow.com/questions/73957076","docker-compose failed to solve: rpc error: code = Unknown desc","1","<docker><tensorflow><docker-compose><dockerfile>","tensorflow"
"https://stackoverflow.com/questions/66490197","Make tf.function error on compilation failure","1","<python><tensorflow>","tensorflow"
"https://stackoverflow.com/questions/62894479","Keras model.predict giving different shape from training label array","1","<tensorflow>","tensorflow"
"https://stackoverflow.com/questions/72351077","Python (Scikeras) - ValueError: Invalid parameter layers for estimator KerasClassifier","1","<python><tensorflow><gridsearchcv>","tensorflow"
"https://stackoverflow.com/questions/73976175","Is passing activity_regularizer as argument to Conv2D() the same as passing it seperately right after Conv2D()? (Tensorflow)","1","<python><tensorflow><regularized>","tensorflow"
