QuestionLink,Title,Score,Tags,
"https://stackoverflow.com/questions/66977227","""Could not load dynamic library 'libcudnn.so.8'"" when running tensorflow on ubuntu 20.04","50","<python><tensorflow>","tensorflow"
"https://stackoverflow.com/questions/70537488","cannot import name '_registerMatType' from 'cv2.cv2'","48","<python><tensorflow><object-detection-api>","tensorflow"
"https://stackoverflow.com/questions/70520120","AttributeError: module 'setuptools._distutils' has no attribute 'version'","40","<python><tensorflow><tensorboard><distutils>","tensorflow"
"https://stackoverflow.com/questions/66083545","Could not load dynamic library 'cudnn64_8.dll'; dlerror: cudnn64_8.dll not found","37","<python><tensorflow>","tensorflow"
"https://stackoverflow.com/questions/65608713","Tensorflow GPU Could not load dynamic library 'cusolver64_10.dll'; dlerror: cusolver64_10.dll not found","29","<python><tensorflow><gpu>","tensorflow"
"https://stackoverflow.com/questions/64193633","Could not load dynamic library 'libcublas.so.10'; dlerror: libcublas.so.10: cannot open shared object file: No such file or directory;","28","<tensorflow><gpu><ubuntu-18.04><nvidia>","tensorflow"
"https://stackoverflow.com/questions/66207609","NotImplementedError: Cannot convert a symbolic Tensor (lstm_2/strided_slice:0) to a numpy array. T","26","<python><numpy><tensorflow>","tensorflow"
"https://stackoverflow.com/questions/68614547","TensorFlow libdevice not found. Why is it not found in the searched path?","23","<python><tensorflow><configuration>","tensorflow"
"https://stackoverflow.com/questions/74956134","Could not load dynamic library 'libnvinfer.so.7'","23","<tensorflow><nvidia><cudnn><tensorrt>","tensorflow"
"https://stackoverflow.com/questions/63078695","SavedModel file does not exist when using Tensorflow hub","23","<file><tensorflow><directory><tensorflow-hub><oserror>","tensorflow"
"https://stackoverflow.com/questions/71000120","Colab: (0) UNIMPLEMENTED: DNN library is not found","20","<tensorflow><google-colaboratory><object-detection>","tensorflow"
"https://stackoverflow.com/questions/64880546","Tensorflow Could not load dynamic library 'libcudart.so.10.0 on ubuntu 18.04","19","<tensorflow><ubuntu-18.04>","tensorflow"
"https://stackoverflow.com/questions/75614728","Cuda 12 + tf-nightly 2.12: Could not find cuda drivers on your machine, GPU will not be used, while every checking is fine and in torch it works","19","<python><tensorflow><gpu>","tensorflow"
"https://stackoverflow.com/questions/67921192","(-5:Bad argument) in function 'rectangle' - Can't parse 'pt1'. Sequence item with index 0 has a wrong type","18","<python><opencv><tensorflow-lite><yolov4>","tensorflow"
"https://stackoverflow.com/questions/63601580","Use GPU with opencv-python","17","<python><python-3.x><tensorflow><opencv>","tensorflow"
"https://stackoverflow.com/questions/68000516","Gradle - Null extracted folder for artifact: ResolvedArtifact","17","<android><gradle><tensorflow-lite>","tensorflow"
"https://stackoverflow.com/questions/70240506","Why is numpy native on M1 Max greatly slower than on old Intel i5?","16","<python><numpy><tensorflow><anaconda><apple-m1>","tensorflow"
"https://stackoverflow.com/questions/64337550","Neither PyTorch nor TensorFlow >= 2.0 have been found.Models won't be available and only tokenizers, configuration and file/data utilities can be used","16","<python><tensorflow><nlp>","tensorflow"
"https://stackoverflow.com/questions/63552169","Some Python objects were not bound to checkpointed values","16","<python><tensorflow><deep-learning><tensorflow2.0><object-detection-api>","tensorflow"
"https://stackoverflow.com/questions/64312153","tf.newaxis operation in TensorFlow","15","<python><tensorflow>","tensorflow"
"https://stackoverflow.com/questions/62870656","File system scheme '[local]' not implemented in Google Colab TPU","15","<python><tensorflow><google-colaboratory><tpu><google-cloud-tpu>","tensorflow"
"https://stackoverflow.com/questions/72255562","Cannot import name 'dtensor' from 'tensorflow.compat.v2.experimental'","15","<python><tensorflow>","tensorflow"
"https://stackoverflow.com/questions/65271399","VS Code / Pylance / Pylint Cannot resolve import","12","<python><tensorflow><visual-studio-code><pylint><pylance>","tensorflow"
"https://stackoverflow.com/questions/70839312","module 'numpy.distutils.__config__' has no attribute 'blas_opt_info'","11","<python><numpy><tensorflow><deep-learning><theano>","tensorflow"
"https://stackoverflow.com/questions/63139273","Flutter TFLite Error: ""metal_delegate.h"" File Not Found","11","<tensorflow><flutter><machine-learning><dart><tensor>","tensorflow"
"https://stackoverflow.com/questions/67045622","tensorflow/stream_executor/cuda/cuda_driver.cc:328] failed call to cuInit: CUDA_ERROR_UNKNOWN: unknown error","11","<python-3.x><gpu><tensorflow2.0><nvidia>","tensorflow"
"https://stackoverflow.com/questions/66141547","NotImplementedError: Cannot convert a symbolic Tensor to a numpy array","10","<numpy><tensorflow>","tensorflow"
"https://stackoverflow.com/questions/69401285","""Attempting to perform BLAS operation using StreamExecutor without BLAS support"" error occurs","10","<tensorflow><jupyter-notebook><gpu><tensorflow2.0><blas>","tensorflow"
"https://stackoverflow.com/questions/67694895","module 'tensorflow._api.v1.compat.v2' has no attribute '__internal__' google colab error","10","<python><tensorflow><google-colaboratory>","tensorflow"
"https://stackoverflow.com/questions/69125173","Accuracy in Calculating Fourth Derivative using Finite Differences in Tensorflow","10","<python><numpy><tensorflow>","tensorflow"
"https://stackoverflow.com/questions/64121386","Google Meet background Blur","9","<tensorflow><tensorflow-lite><tensorflow.js><google-meet>","tensorflow"
"https://stackoverflow.com/questions/63258022","Non-OK-status: GpuLaunchKernel(...) status: Internal: no kernel image is available for execution on the device","9","<tensorflow><nvidia><cudnn>","tensorflow"
"https://stackoverflow.com/questions/66962099","Getting attribute error when using AUTOTUNE in Tensorflow?","9","<python><tensorflow>","tensorflow"
"https://stackoverflow.com/questions/68119561","Stopping and starting a deep learning google cloud VM instance causes tensorflow to stop recognizing GPU","9","<tensorflow><google-cloud-platform><nvidia><google-dl-platform>","tensorflow"
"https://stackoverflow.com/questions/69315586","When are Model call() and train_step() called?","9","<python><tensorflow><machine-learning>","tensorflow"
"https://stackoverflow.com/questions/64662085","Fix not load dynamic library for Tensorflow GPU","8","<python><tensorflow>","tensorflow"
"https://stackoverflow.com/questions/66605679","Broadcast and concatenate ragged tensors","8","<python><tensorflow><concatenation><ragged><ragged-tensors>","tensorflow"
"https://stackoverflow.com/questions/64794378","Correct pb file to move Tensorflow model into ML.NET","8","<python><.net><tensorflow><nodes><ml.net>","tensorflow"
"https://stackoverflow.com/questions/63702841","Batch prediction using a trained Object Detection APIs model and TF 2","8","<tensorflow><object><batch-processing><prediction><detection>","tensorflow"
"https://stackoverflow.com/questions/65402617","Tensorflow automl model in react","8","<javascript><reactjs><tensorflow><tensorflow.js><automl>","tensorflow"
"https://stackoverflow.com/questions/70268140","Could not load dynamic library 'libcublasLt.so.11'; dlerror: libcublasLt.so.11: cannot open shared object file: No such file or directory","7","<python><tensorflow><cuda><driver>","tensorflow"
"https://stackoverflow.com/questions/63122486","the tensorflow docker gpu image doesn't detect my GPU","7","<linux><docker><tensorflow><nvidia>","tensorflow"
"https://stackoverflow.com/questions/69834335","Loading YOLO: invalid index to scalar variable","7","<python><tensorflow><opencv><machine-learning><yolo>","tensorflow"
"https://stackoverflow.com/questions/65704588","Neural network hyperparameter tuning - is setting random seed a good idea?","7","<tensorflow><machine-learning><deep-learning><neural-network><hyperparameters>","tensorflow"
"https://stackoverflow.com/questions/72411825","Jupyter notebook in vscode with virtual environment fails to import tensorflow","7","<python><visual-studio-code><jupyter-notebook><tensorflow2.0>","tensorflow"
"https://stackoverflow.com/questions/68191448","Unknown image file format. One of JPEG, PNG, GIF, BMP required","7","<python><tensorflow>","tensorflow"
"https://stackoverflow.com/questions/70818269","Tensorflow ValueError: Unexpected result of `train_function` (Empty logs). Please use `Model.compile(..., run_eagerly=True)","7","<python><tensorflow><conv-neural-network>","tensorflow"
"https://stackoverflow.com/questions/71828861","Filtering audio signal in TensorFlow","7","<python><tensorflow><scipy><dataset><signal-processing>","tensorflow"
"https://stackoverflow.com/questions/69133906","Taking gradients when using tf.function","7","<python><tensorflow2.0><decorator><gradienttape>","tensorflow"
"https://stackoverflow.com/questions/67167886","Make TensorFlow use the GPU on an ARM Mac","6","<python><macos><tensorflow><deep-learning><arm>","tensorflow"
"https://stackoverflow.com/questions/73569804","Dataset.batch doesn't work as expected with a zipped dataset","6","<python><tensorflow><tensorflow-datasets>","tensorflow"
"https://stackoverflow.com/questions/63909553","What is tensorflow.python.data.ops.dataset_ops.PrefetchDataset?","6","<tensorflow>","tensorflow"
"https://stackoverflow.com/questions/70645074","Tensorflow setup on RStudio/ R | CentOS","6","<python><r><tensorflow><centos7>","tensorflow"
"https://stackoverflow.com/questions/63763809","Error when converting xml files to tfrecord files","6","<python><tensorflow><object-detection>","tensorflow"
"https://stackoverflow.com/questions/64114707","Create your own tfds.load","6","<python><tensorflow>","tensorflow"
"https://stackoverflow.com/questions/67505710","PIL.UnidentifiedImageError: cannot identify image file <_io.BytesIO object","6","<python><tensorflow><image-classification>","tensorflow"
"https://stackoverflow.com/questions/64867031","TensorFlow error: tensorflow/core/framework/op_kernel.cc:1767] OP_REQUIRES failed at conv_ops.cc:539 : Resource exhausted","6","<python><tensorflow>","tensorflow"
"https://stackoverflow.com/questions/64606267","Angular typescript typecheck issues when importing tensorflow in web worker","6","<angular><typescript><tensorflow><web-worker><tsconfig>","tensorflow"
"https://stackoverflow.com/questions/62866577","Android - TFLite OD - Cannot copy to a TensorFlowLite tensor (normalized_input_image_tensor) with 307200 bytes from a Java Buffer with 4320000 bytes","6","<android><tensorflow><google-cloud-platform><tensorflow-lite>","tensorflow"
"https://stackoverflow.com/questions/64081214","""tensorflow.python.framework.errors_impl.FailedPreconditionError"" while running ""model_main_tf2.py"" for training object detection model in tensorflow","6","<python-3.x><tensorflow><tensorflow2.0><object-detection-api>","tensorflow"
"https://stackoverflow.com/questions/63456427","This version of TensorFlow Probability requires TensorFlow version >= 2.3","6","<python-3.x><tensorflow>","tensorflow"
"https://stackoverflow.com/questions/72305688","Can't load tflite custom model into web using react","6","<reactjs><typescript><tensorflow><machine-learning><tensorflow-lite>","tensorflow"
"https://stackoverflow.com/questions/66087844","Jetson NX optimize tensorflow model using TensorRT","6","<tensorflow><tensorrt><nvidia-jetson>","tensorflow"
"https://stackoverflow.com/questions/67227577","Pip error ""No matching distribution found for perceptilabs""","6","<python><windows><tensorflow><pip>","tensorflow"
"https://stackoverflow.com/questions/67439611","Chunk tensorflow dataset records into multiple records","6","<tensorflow><conv-neural-network><tensorflow-datasets><tfrecord>","tensorflow"
"https://stackoverflow.com/questions/67638345","Tensorflow dataset with multiple inputs and target","6","<python><tensorflow><tensorflow-datasets><tf.data.dataset>","tensorflow"
"https://stackoverflow.com/questions/71688065","Generic requirements.txt for TensorFlow on both Apple M1 and other devices","6","<python><macos><tensorflow><apple-m1><requirements.txt>","tensorflow"
"https://stackoverflow.com/questions/63515767","Tensorflow 2.3.0 does not detect GPU","6","<python><tensorflow><gpu>","tensorflow"
"https://stackoverflow.com/questions/72029857","No module named 'tensorflow.compat'","6","<python><tensorflow><pip><teachable-machine>","tensorflow"
"https://stackoverflow.com/questions/64224051","tf.lookup.StaticHashTable with lists (of arbitrary sizes) as values","5","<python><tensorflow><dictionary><hashtable><lookup>","tensorflow"
"https://stackoverflow.com/questions/70091290","Tensorflow Datasets: Crop/Resize images per batch after dataset.batch()","5","<python><tensorflow><tensorflow-datasets>","tensorflow"
"https://stackoverflow.com/questions/68211406","Why do I get ""slice index 0 of dimension 0 out of bounds"" error in Tensorflow for Java?","5","<java><tensorflow>","tensorflow"
"https://stackoverflow.com/questions/70118623","ValueError after attempting to use OneHotEncoder and then normalize values with make_column_transformer","5","<python><pandas><tensorflow><deep-learning><one-hot-encoding>","tensorflow"
"https://stackoverflow.com/questions/66910103","What is a trackable object?","5","<python><python-3.x><tensorflow><tensorflow2.0>","tensorflow"
"https://stackoverflow.com/questions/65446130","it requires specifying NormalizationOptions metadata to preprocess input images","5","<android><tensorflow><yolo><google-mlkit>","tensorflow"
"https://stackoverflow.com/questions/66288078","any easy way to get imagenet dataset for training custom model in tensorflow?","5","<python><tensorflow>","tensorflow"
"https://stackoverflow.com/questions/67789639","What do the arguments for TFRecordOptions actually mean (wrt tf.io.TFRecordWriter)?","5","<python><tensorflow><tfrecord>","tensorflow"
"https://stackoverflow.com/questions/66787279","tcmalloc: large alloc python in Google Colab","5","<python><tensorflow><memory-management><google-colaboratory><tcmalloc>","tensorflow"
"https://stackoverflow.com/questions/71211053","What tensorflow's flat_map + window.batch() does to a dataset/array?","5","<python><tensorflow><tensorflow-datasets><data-preprocessing>","tensorflow"
"https://stackoverflow.com/questions/65358676","What does 'with strategy.scope():' or 'with tf.distribute.experimental.TPUStrategy(tpu).scope():' do to the creation of a NN?","5","<tensorflow><tensorflow2.0><tpu>","tensorflow"
"https://stackoverflow.com/questions/64273829","CelebA Dataset inaccessible using tfds.load()","5","<python-3.x><image><deep-learning><tensorflow2.0><tensorflow-datasets>","tensorflow"
"https://stackoverflow.com/questions/69031604","Tensorflow running out of GPU memory: Allocator (GPU_0_bfc) ran out of memory trying to allocate","5","<python><tensorflow><tensorflow2.0><tensorflow-datasets>","tensorflow"
"https://stackoverflow.com/questions/70466992","partial tucker decomposition","5","<python><tensorflow><machine-learning><tensorly>","tensorflow"
"https://stackoverflow.com/questions/63653903","What does FPN in SSD MobileNet V2 FPNLite 320x320 stand for?","5","<python><tensorflow><tensorflow2.0><tensorflow-lite><mobilenet>","tensorflow"
"https://stackoverflow.com/questions/71335585","HuggingFace | ValueError: Connection error, and we cannot find the requested files in the cached path. Please try again or make sure your Internet con","5","<python-3.x><tensorflow><huggingface-transformers><valueerror><gpt-2>","tensorflow"
"https://stackoverflow.com/questions/69752055","ValueError: None values not supported. Code working properly on CPU/GPU but not on TPU","5","<python><tensorflow><machine-learning><deep-learning><tpu>","tensorflow"
"https://stackoverflow.com/questions/65548876","TFJS model only predicting the same value for binary classification task","5","<javascript><tensorflow><machine-learning><classification><tensorflow.js>","tensorflow"
"https://stackoverflow.com/questions/63325216","What is the right way to convert saved tensorflow model to tensorflow Lite","5","<tensorflow><tensorflow2.0><tensorflow-lite>","tensorflow"
"https://stackoverflow.com/questions/65492399","Gradient descent using TensorFlow is much slower than a basic Python implementation, why?","5","<python><python-3.x><tensorflow><linear-regression><gradient-descent>","tensorflow"
"https://stackoverflow.com/questions/73991600","Equivalent of tf.contrib.legacy_seq2seq.attention_decoder in tensorflow 2 after upgrade","5","<python><tensorflow><tensorflow2.0><seq2seq><tensorflow1.15>","tensorflow"
"https://stackoverflow.com/questions/65718838","Tensorflow GPU long startup time","5","<tensorflow><time><gpu><startup><rtx>","tensorflow"
"https://stackoverflow.com/questions/69480199","pad_token_id not working in hugging face transformers","5","<python><python-3.x><tensorflow><huggingface-transformers>","tensorflow"
"https://stackoverflow.com/questions/63415102","TFX IndexError on Evaluator component","5","<python><tensorflow><tfx>","tensorflow"
"https://stackoverflow.com/questions/65288044","Generating TFRecord format data from C+","5","<python><c++><tensorflow><protocol-buffers><tfrecord>","tensorflow"
"https://stackoverflow.com/questions/64081367","Slicing a tensor with a tensor of indices and tf.gather","4","<python><tensorflow>","tensorflow"
"https://stackoverflow.com/questions/68612779","Efficient way to iterate over tf.data.Dataset","4","<python><tensorflow><tensorflow2.0><tensorflow-datasets>","tensorflow"
"https://stackoverflow.com/questions/72832509","Tensorflow equivalent for cv2.addWeighted?","4","<python><tensorflow><opencv><image-processing><computer-vision>","tensorflow"
"https://stackoverflow.com/questions/64510791","TF2 Object Detection API: model_main_tf2.py - validation loss?","4","<python><tensorflow><tensorflow2.0><object-detection><object-detection-api>","tensorflow"
"https://stackoverflow.com/questions/64735352","Details about alpha in tf.nn.leaky_relu( features, alpha=0.2, name=None )","4","<python><tensorflow><deep-learning><neural-network><activation-function>","tensorflow"
"https://stackoverflow.com/questions/66141235","Jupyter with docker: __init__() got an unexpected keyword argument 'column'","4","<python><docker><jupyter-notebook><tensorflow2.0>","tensorflow"
"https://stackoverflow.com/questions/68902851","failed to alloc X bytes unified memory; result: CUDA_ERROR_OUT_OF_MEMORY: out of memory","4","<tensorflow><out-of-memory><gpu><slurm>","tensorflow"
"https://stackoverflow.com/questions/63407284","Backpropagation in an Tensorflow.js Neural Network","4","<javascript><neural-network><artificial-intelligence><backpropagation><tensorflow.js>","tensorflow"
"https://stackoverflow.com/questions/63418506","Converting ONNX model to TensorFlow Lite","4","<python><tensorflow><onnx>","tensorflow"
"https://stackoverflow.com/questions/69426006","Tensorflow ""Transformer model for language understanding"" with another Dataset?","4","<python><tensorflow><translation><transformer-model><opennmt>","tensorflow"
"https://stackoverflow.com/questions/68945096","Tensorflow Object Detection Api M1 Macbook Conflict Error","4","<python><tensorflow><dependencies><object-detection-api><apple-m1>","tensorflow"
"https://stackoverflow.com/questions/63862004","Error restoring weights into a VGG-16 network","4","<python><tensorflow><autoencoder><vgg-net>","tensorflow"
"https://stackoverflow.com/questions/69782818","Turn a tf.data.Dataset to a jax.numpy iterator","4","<python><tensorflow><numpy-ndarray><jax>","tensorflow"
"https://stackoverflow.com/questions/64631876","Input 0 of layer max_pooling2d is incompatible with the layer: expected ndim=4, found ndim=5. Full shape received: [None, 4, 10, 8, 32]","4","<python><tensorflow><conv-neural-network>","tensorflow"
"https://stackoverflow.com/questions/64680272","Tensorflow.js tf.browser.fromPixels() must be an HTMLVideoElement","4","<javascript><node.js><tensorflow.js>","tensorflow"
"https://stackoverflow.com/questions/63079961","Trouble saving repeated protobuf object to file (Python)","4","<python><tensorflow><protocol-buffers><proto><protobuf-python>","tensorflow"
"https://stackoverflow.com/questions/65202448","Tensorflow 2 Object Detection API - Can/Should I use K-Fold Cross Validation?","4","<deep-learning><tensorflow2.0><cross-validation><object-detection-api>","tensorflow"
"https://stackoverflow.com/questions/65750675","Why do q_net has this number of input layers?","4","<python><tensorflow><neural-network><artificial-intelligence><reinforcement-learning>","tensorflow"
"https://stackoverflow.com/questions/63578210","face-api and tensorflow.js not working in browser","4","<javascript><html><tensorflow.js><face-api>","tensorflow"
"https://stackoverflow.com/questions/64264509","esp32_cam read and process image","4","<c++><arduino><tensorflow-lite><esp32>","tensorflow"
"https://stackoverflow.com/questions/63356571","Running a Tensorflow program on an IPU Model throws an ""Illegal instruction (core dumped)"" error","4","<tensorflow><ipu>","tensorflow"
"https://stackoverflow.com/questions/65676389","Huggingface TFBertForSequenceClassification always predicts the same label","4","<python><tensorflow><bert-language-model><huggingface-transformers>","tensorflow"
"https://stackoverflow.com/questions/63718559","Finding most similar sentences among all in python","4","<python><tensorflow><scikit-learn><sentence-similarity>","tensorflow"
"https://stackoverflow.com/questions/66181402","Feed forward ANN stuck at testing accuracy 42% for MNIST images","4","<python><tensorflow><mnist><feed-forward>","tensorflow"
"https://stackoverflow.com/questions/63916848","module 'tensorflow' has no attribute 'set_random_seed' for RASA NLU supervised embeddings pipeline trainer","4","<python><tensorflow><training-data><rasa-nlu><rasa>","tensorflow"
"https://stackoverflow.com/questions/67068742","ValueError: Cannot set tensor: Dimension mismatch. Got 3 but expected 4 for input 0","4","<python><tensorflow><tensorflow2.0><tensorflow-lite>","tensorflow"
"https://stackoverflow.com/questions/63756756","Model inputs must come from `tf.keras.Input` ..., they cannot be the output of a previous non-Input layer","4","<python><tensorflow><autoencoder><encoder-decoder>","tensorflow"
"https://stackoverflow.com/questions/66718587","Sorting a matrix by column","4","<javascript><tensorflow><matrix><tensorflow.js>","tensorflow"
"https://stackoverflow.com/questions/66514435","Convert a column of dataframe to numpy array or tensor based on other columns","4","<python><pandas><numpy><tensorflow>","tensorflow"
"https://stackoverflow.com/questions/65045232","Set values in row to zero before index value of row [NumPy or Tensorflow]","4","<python><arrays><numpy><tensorflow>","tensorflow"
"https://stackoverflow.com/questions/63763459","Tensorflow: ImportError: DLL load failed while importing _pywrap_tensorflow_internal: The specified module could not be found","4","<python><tensorflow>","tensorflow"
"https://stackoverflow.com/questions/66888763","InvalidVersionSpecError: Invalid version spec: =2.7","4","<python><tensorflow><conda>","tensorflow"
"https://stackoverflow.com/questions/62993389","Change of the dataset type in the execution stack","4","<python><tensorflow><tensorflow-federated>","tensorflow"
"https://stackoverflow.com/questions/67307566","Unhandled Exception: PlatformException(Failed to run model, Interpreter busy, java.lang.RuntimeException: Interpreter busy in flutter","4","<android><ios><flutter><tensorflow><dart>","tensorflow"
"https://stackoverflow.com/questions/64497977","TensorFlow: convert tf.Dataset to tf.Tensor","4","<python><tensorflow><dataset><tensorflow2.0><tensorflow-datasets>","tensorflow"
"https://stackoverflow.com/questions/67193016","All Conda command either get killed by zsh or no output","4","<python><bash><tensorflow><conda><apple-m1>","tensorflow"
"https://stackoverflow.com/questions/63178526","""No Operation named [input] in the Graph"" in Java","4","<java><python><tensorflow><machine-learning><tensorflow2.0>","tensorflow"
"https://stackoverflow.com/questions/68237724","failed call to cuInit: CUDA_ERROR_NO_DEVICE: no CUDA-capable device is detected","4","<python><tensorflow><deep-learning>","tensorflow"
"https://stackoverflow.com/questions/65328663","Video file to image stream in flutter","4","<image><flutter><tensorflow><dart><video>","tensorflow"
"https://stackoverflow.com/questions/75057274","Saving Custom TableNet Model (VGG19 based) for table extraction - Azure Databricks","4","<python><azure><tensorflow><azure-databricks><vgg-net>","tensorflow"
"https://stackoverflow.com/questions/70067588","ValueError: Input 0 of layer ""sequential"" is incompatible with the layer: expected shape=(None, 455, 30), found shape=(None, 30)","4","<python><tensorflow><sklearn-pandas>","tensorflow"
"https://stackoverflow.com/questions/70465064","Running two Tensorflow trainings in parallel using joblib and dask","4","<python><tensorflow><dask><dask-distributed><joblib>","tensorflow"
"https://stackoverflow.com/questions/65334652","Error subclassing model in Tensorflow 2 ""InaccessibleTensorError""","4","<tensorflow><neural-network><tensorflow2.0>","tensorflow"
"https://stackoverflow.com/questions/66711706","Jax, jit and dynamic shapes: a regression from Tensorflow?","4","<python><tensorflow><jax>","tensorflow"
"https://stackoverflow.com/questions/67419320","Cannot copy to a TensorFlowLite tensor (input_1) with 150528 bytes from a Java Buffer with 602112 bytes","4","<java><android><tensorflow><tensorflow-lite>","tensorflow"
