QuestionLink,Title,Score,Tags,
"https://stackoverflow.com/questions/64006585","AttributeError: module 'tensorflow.io' has no attribute 'experimental'","3","<python><python-3.x><tensorflow><tensorflow2.0>","tensorflow"
"https://stackoverflow.com/questions/71113392","try and except do not work with tensorflow exceptions","3","<python><tensorflow>","tensorflow"
"https://stackoverflow.com/questions/65501905","realtime object detection No module named 'tensorflow.compat.v1'","3","<python><tensorflow><object-detection>","tensorflow"
"https://stackoverflow.com/questions/65946627","zsh: illegal hardware instruction python when Tensorflow on macbook pro M1","3","<python><python-3.x><macos><tensorflow><apple-m1>","tensorflow"
"https://stackoverflow.com/questions/66206118","TypeError: Expected tensorflow.python.framework.tensor_spec.TensorSpec, found numpy.ndarray","3","<tensorflow-federated>","tensorflow"
"https://stackoverflow.com/questions/64071574","Why isn't SchemaGen supported in tfdv.display_schema()?","2","<tensorflow2.0><tfx><tensorflow-data-validation>","tensorflow"
"https://stackoverflow.com/questions/64063914","Unknown regularizer: L2 in tensorflowjs","2","<javascript><tensorflow><machine-learning><tensorflow.js>","tensorflow"
"https://stackoverflow.com/questions/72125011","Efficient pooling operation in Tensorflow : Custom pooling layer","2","<python><tensorflow><tensor><max-pooling>","tensorflow"
"https://stackoverflow.com/questions/66211959","TensorFlow crashes with Failed to create cuSolverDN instance when tf.linalg.inv is called","2","<python><tensorflow>","tensorflow"
"https://stackoverflow.com/questions/64807842","Using tf.data.experimental.make_csv_dataset for time series data","2","<csv><tensorflow><time-series><dataset>","tensorflow"
"https://stackoverflow.com/questions/64806566","4X + 2 = 0 in tensorflow","2","<python><tensorflow><tensorflow2.0>","tensorflow"
"https://stackoverflow.com/questions/71279633","Getting encoded output when I print hindi text from a tensorflow dataset","2","<python><python-3.x><tensorflow><tensorflow-datasets>","tensorflow"
"https://stackoverflow.com/questions/66617029","Taylor Series of cos(x) +1 with Tensorflow","2","<python><tensorflow>","tensorflow"
"https://stackoverflow.com/questions/64748103","Not enough disk space when loading dataset with TFDS","2","<tensorflow><large-data>","tensorflow"
"https://stackoverflow.com/questions/63697439","Tensorflow does not get GPU","2","<python><tensorflow>","tensorflow"
"https://stackoverflow.com/questions/68444995","inverse_transform a tensorflow variable: TypeError: __array__() takes 1 positional argument but 2 were given","2","<python><tensorflow><scikit-learn><neural-network>","tensorflow"
"https://stackoverflow.com/questions/65561252","making a custom (tf.function) function 2d array","2","<python><arrays><tensorflow>","tensorflow"
"https://stackoverflow.com/questions/66603346","Failure to load model in tensorflow.js","2","<tensorflow><tensorflow.js>","tensorflow"
"https://stackoverflow.com/questions/63914731","Fail to crop image with error: failed to compile fragment shader Tensorflow.js","2","<javascript><reactjs><react-native><tensorflow><tensorflow.js>","tensorflow"
"https://stackoverflow.com/questions/69233317","Different sample rate SR for same wav file between librosa and tensorflow","2","<python><tensorflow><nlp><wav><librosa>","tensorflow"
"https://stackoverflow.com/questions/71168412","Using BatchedPyEnvironment in tf_agents","2","<tensorflow><gpu><reinforcement-learning>","tensorflow"
"https://stackoverflow.com/questions/64054555","TF2 - tf.function and class variables breaking","2","<python><tensorflow><tensorflow2.0>","tensorflow"
"https://stackoverflow.com/questions/64789833","Extracting string with regex from a tf.Tensor in Tensorflow 2?","2","<regex><tensorflow><tensorflow-serving>","tensorflow"
"https://stackoverflow.com/questions/65965807","Getting error: Uncaught (in promise) TypeError: tf.browser.fromPixel is not a function","2","<javascript><tensorflow><machine-learning><artificial-intelligence><tensorflow.js>","tensorflow"
"https://stackoverflow.com/questions/71175695","Tensorflow conv1d/Keras Conv1D strange performance variation","2","<performance><tensorflow><conv1d>","tensorflow"
"https://stackoverflow.com/questions/63751261","Tensorfow.js find median of tensor","2","<statistics><tensorflow.js>","tensorflow"
"https://stackoverflow.com/questions/64877001","Quantile Regression with Tensorflow Probability","2","<python><r><tensorflow2.0><tensorflow-probability><quantile-regression>","tensorflow"
"https://stackoverflow.com/questions/69079614","What does tf.keras.backend.set_learning_phase actually do?","2","<tensorflow><tensorflow2.0>","tensorflow"
"https://stackoverflow.com/questions/68481519","Running tflite classifier in Android (Kotlin)","2","<python><kotlin><tensorflow-lite>","tensorflow"
"https://stackoverflow.com/questions/63485453","Saving previous values of a Tensorflow.js tensor","2","<javascript><tensorflow><if-statement><optimization><tensor>","tensorflow"
"https://stackoverflow.com/questions/68640658","Can I update cuda version through conda?","2","<cuda><conda><tensorflow2.0>","tensorflow"
"https://stackoverflow.com/questions/65482637","TensorFlow works with Slurm Interactive Session but Not Slurm Job","2","<tensorflow><slurm>","tensorflow"
"https://stackoverflow.com/questions/70244407","Tensorflow Lite, Image size is zero error","2","<python><tensorflow><tensorflow2.0><tensorflow-lite>","tensorflow"
"https://stackoverflow.com/questions/63546827","Convert TFLite (TensorFlow) to MLModel (Apple)","2","<python><tensorflow><tensorflow2.0><coreml><coremltools>","tensorflow"
"https://stackoverflow.com/questions/62889537","TensorFlow Serving vs. TensorFlow Inference (container type for SageMaker model)","2","<tensorflow-serving><amazon-sagemaker>","tensorflow"
"https://stackoverflow.com/questions/70655540","Defining a variable depth Fully Convolutional Network in Tensorflow","2","<python><tensorflow>","tensorflow"
"https://stackoverflow.com/questions/70412894","Python Running Error on Macbook pro m1 max (Running on Tensorflow)","2","<python><tensorflow><deep-learning><lstm><apple-m1>","tensorflow"
"https://stackoverflow.com/questions/63550752","TF2 - GradientTape vs Model.fit() - Why does GradientTape doesn't work?","2","<tensorflow><machine-learning><deep-learning><tensorflow2.0><gradienttape>","tensorflow"
"https://stackoverflow.com/questions/64555580","Change saved tensorflow model input shape at inference time","2","<tensorflow><input><tensorflow2.0><shapes>","tensorflow"
"https://stackoverflow.com/questions/74428413","Understanding dimensions in MultiHeadAttention layer of Tensorflow","2","<tensorflow><nlp><transformer-model><attention-model>","tensorflow"
"https://stackoverflow.com/questions/67356839","input_image_meta shape error while using pixellib custom trainig on images","2","<python><tensorflow><image-processing><deep-learning>","tensorflow"
"https://stackoverflow.com/questions/63144076","AttributeError: 'collections.OrderedDict' object has no attribute 'train'","2","<python><tensorflow><collections><tensorboard><ordereddictionary>","tensorflow"
"https://stackoverflow.com/questions/63553375","Outputting all values of an large tensor in Tensorflow.js","2","<javascript><tensorflow><output><tensor><tensorflow.js>","tensorflow"
"https://stackoverflow.com/questions/66579324","Error running run_seq2seq.py Transformers training script","2","<python><tensorflow><machine-learning><nlp><huggingface-transformers>","tensorflow"
"https://stackoverflow.com/questions/74503788","Tf-agent Actor/Learner: TFUniform ReplayBuffer dimensionality issue - invalid shape of Replay Buffer vs. Actor update","2","<tensorflow><reinforcement-learning><openai-gym><dqn><tf-agent>","tensorflow"
"https://stackoverflow.com/questions/63168524","Internal error while converting TensorFlow Faster R-CNN frozen graph to intel openVINO framework","2","<python><windows><tensorflow><openvino>","tensorflow"
"https://stackoverflow.com/questions/63628513","Quantization not yet supported for op: 'DEQUANTIZE' for tensorflow 2.x","2","<tensorflow2.0><tensorflow-lite><quantization><quantization-aware-training>","tensorflow"
"https://stackoverflow.com/questions/74066659","Apply preprocessing only to images , not to masks","2","<python><tensorflow><tensorflow2.0><tensorflow-datasets>","tensorflow"
"https://stackoverflow.com/questions/74073113","Output tensors of a Functional model must be the output of a TensorFlow `Layer`","2","<python><python-3.x><tensorflow><huggingface-transformers><roberta>","tensorflow"
"https://stackoverflow.com/questions/63415216","List of 2d Tensors to one 3d Tensor","2","<python><tensorflow><tensor><conv-neural-network><word-embedding>","tensorflow"
"https://stackoverflow.com/questions/68962721","Tensorflow version 2.6.0, cuda version=10.2 not utilizing GPU","2","<python-3.x><tensorflow><installation><gpu>","tensorflow"
"https://stackoverflow.com/questions/74204565","Could not load dynamic library 'libcudart.so.11.0' inside docker container","2","<python><docker><tensorflow><cuda><gpu>","tensorflow"
"https://stackoverflow.com/questions/67496720","Converting Yolov4 Tiny to tflite. error:cannot reshape array of size 372388 into shape (256,256,3,3)","2","<tensorflow><yolov4>","tensorflow"
"https://stackoverflow.com/questions/64849393","Nonlinear Exponential Regression with Tensorflow.js","2","<javascript><tensorflow><machine-learning><tensorflow.js><exponential>","tensorflow"
"https://stackoverflow.com/questions/66129709","What does a -1 mean in the shape of a tensor input?","2","<tensorflow><tensorflow.js><tensorflowjs-converter>","tensorflow"
"https://stackoverflow.com/questions/72821373","Combine two Tensorflow Datasets","2","<python><tensorflow><deep-learning><tensorflow-datasets>","tensorflow"
"https://stackoverflow.com/questions/68595228","tf.where with multiple conditions","2","<python><numpy><tensorflow>","tensorflow"
"https://stackoverflow.com/questions/64889770","tf.divide() and tf.cast() will interrupt the gradient propagation of my program. Is there any way to solve this problem","2","<python><tensorflow>","tensorflow"
"https://stackoverflow.com/questions/63567357","Error using model.fit with dataset as input for the super-resolution like model","2","<python><tensorflow>","tensorflow"
"https://stackoverflow.com/questions/67360987","BERT model bug encountered during training","2","<python><pandas><numpy><tensorflow><bert-language-model>","tensorflow"
"https://stackoverflow.com/questions/71322383","Tff: define the usage of Tensorflow.take() function","2","<python><tensorflow><machine-learning><tensorflow-datasets><tensorflow-federated>","tensorflow"
"https://stackoverflow.com/questions/68655419","Tensorboard for Tensorflow.JS under Windows 10","2","<tensorboard><tensorflow.js>","tensorflow"
"https://stackoverflow.com/questions/63578341","Simple neural network in tensorflow -> shape problem","2","<python><tensorflow><neural-network>","tensorflow"
"https://stackoverflow.com/questions/67361081","Tensorflow 2 - what is 'index depth' in tensor_scatter_nd_update?","2","<tensorflow2.0>","tensorflow"
"https://stackoverflow.com/questions/72126775","Why is cuda-gdb much slower than gdb in executing the same program without breakpoints in CUDA kernels?","2","<python><tensorflow><cuda><gdb><cuda-gdb>","tensorflow"
"https://stackoverflow.com/questions/65356923","TensorFlow2 - Model subclassing ValueError","2","<python><tensorflow><neural-network>","tensorflow"
"https://stackoverflow.com/questions/65251058","Train model on Colab TPU with distributed strategy","2","<python><tensorflow><tensorflow2.0><distributed-computing><tpu>","tensorflow"
"https://stackoverflow.com/questions/72223968","What do parentheses do when used after a variable in Python?","2","<python><tensorflow>","tensorflow"
"https://stackoverflow.com/questions/72166920","Image processing in Tensor flow TFX pipelines","2","<python><tensorflow><machine-learning><tfx>","tensorflow"
"https://stackoverflow.com/questions/63645132","Normalizing difference between x_train /= 255.0 and x_train = x_train/255.0","2","<python><tensorflow>","tensorflow"
"https://stackoverflow.com/questions/69606596","Reduce Training steps for SSD-300","2","<python><tensorflow><object-detection><single-shot-detector>","tensorflow"
"https://stackoverflow.com/questions/72255992","Error in implemeting tensorflow object detection model","2","<python><tensorflow><object-detection><object-detection-api>","tensorflow"
"https://stackoverflow.com/questions/72254129","Tensorflow - range wise regression loss","2","<python><tensorflow><loss-function>","tensorflow"
"https://stackoverflow.com/questions/63576397","No gradient on ResNetv2 101 with TensorFlow","2","<python><tensorflow2.0><resnet>","tensorflow"
"https://stackoverflow.com/questions/69608765","Find the max value across all features in tensorflow","2","<python><tensorflow><tensorflow-datasets>","tensorflow"
"https://stackoverflow.com/questions/63690654","TypeError: Cannot call a class as a function after deploying to Netlify?","2","<javascript><reactjs><tensorflow><netlify>","tensorflow"
"https://stackoverflow.com/questions/71285825","Using create_tf_dataset_for_client() to define the training examples in the dataset","2","<python><tensorflow><tensorflow-datasets><tensorflow-federated><federated-learning>","tensorflow"
"https://stackoverflow.com/questions/65161746","Why does a DLL error appear when importing tensorflow?","2","<python-3.x><tensorflow><pycharm><windows-10><importerror>","tensorflow"
"https://stackoverflow.com/questions/69172976","Tensorflow (in R) cannot find libcudart.so.11.0","2","<r><linux><tensorflow>","tensorflow"
"https://stackoverflow.com/questions/63932436","ModuleNotFoundError: No module named 'tensorflow' Vs code","2","<python><tensorflow><visual-studio-code><pip><python-3.7>","tensorflow"
"https://stackoverflow.com/questions/72367772","Create Tensorflow Dataset with dataframe of images and labels","2","<python><tensorflow><image-processing><computer-vision><tensorflow-datasets>","tensorflow"
"https://stackoverflow.com/questions/65375116","""Error: Error in oneHot: depth must be >=2, but it is 1"" in tensorflow.js","2","<tensorflow><tensorflow.js>","tensorflow"
"https://stackoverflow.com/questions/68444180","`tf.case` and `tf.cond` executes all the functions within in TensorFlow","2","<python><tensorflow>","tensorflow"
"https://stackoverflow.com/questions/63976057","Error when checking target: expected dense_Dense2 to have shape x, but got array with shape y","2","<tensorflow><tensorflow2.0><tensorflow.js>","tensorflow"
"https://stackoverflow.com/questions/71077440","module 'tensorboard.summary._tf.summary' has no attribute 'FileWriter'","2","<python><python-3.x><tensorflow><tensorflow2.0><tensorboard>","tensorflow"
"https://stackoverflow.com/questions/65703748","What should be the input_shape here?","2","<python><tensorflow><conv-neural-network>","tensorflow"
"https://stackoverflow.com/questions/70190336","Tensorflow: ZeroDivisionError during concat of singel elements of tensor","2","<python><tensorflow><tensor><tensorflow2.x>","tensorflow"
"https://stackoverflow.com/questions/63996947","Interpolate weights in TensorFlow","2","<tensorflow><machine-learning>","tensorflow"
"https://stackoverflow.com/questions/63679503","Why did it take so long to create endpoint with AWS Sagemaker using Boto3?","2","<python><amazon-web-services><tensorflow><boto3><amazon-sagemaker>","tensorflow"
"https://stackoverflow.com/questions/66092456","Tensorflow performance drop for second calculation","2","<performance><tensorflow><gpu><tensorflow2.0><matrix-multiplication>","tensorflow"
"https://stackoverflow.com/questions/70243825","A question about input size in a tensorflow neural network","2","<python><tensorflow><deep-learning>","tensorflow"
"https://stackoverflow.com/questions/64771324","Why does Tensorflow's automatic differentiation fail when .numpy() is used in the loss function?","2","<python><numpy><tensorflow>","tensorflow"
"https://stackoverflow.com/questions/63377198","what is the difference between pooled output and sequence output in bert layer?","2","<python-3.x><tensorflow><neural-network><text-classification><bert-language-model>","tensorflow"
"https://stackoverflow.com/questions/64618205","tensorflow earlystopping does not work properly","2","<python-3.x><tensorflow>","tensorflow"
"https://stackoverflow.com/questions/70362733","Input to the Neural Network using an array","2","<python><arrays><tensorflow><deep-learning><neural-network>","tensorflow"
"https://stackoverflow.com/questions/64824662","TensorFlow - ValueError: Checkpoint version should be V2","2","<python><tensorflow>","tensorflow"
"https://stackoverflow.com/questions/68905023","Tensorflow custom activation function with tf.cond","2","<tensorflow>","tensorflow"
"https://stackoverflow.com/questions/64645503","Tensorflow-datasets: Cannot batch tensors of different shapes error even after resize?","2","<python><tensorflow><computer-vision>","tensorflow"
"https://stackoverflow.com/questions/70408145","Select a column without ""losing"" a dimension","2","<python><tensorflow>","tensorflow"
"https://stackoverflow.com/questions/69611213","TypeError: reduce_sum() got an unexpected keyword argument 'reduction_indices'?","2","<python><tensorflow><image-processing><computer-vision>","tensorflow"
"https://stackoverflow.com/questions/70683969","Writing Pyspark Dataframe to TFrecords file","2","<tensorflow><apache-spark><pyspark><databricks>","tensorflow"
"https://stackoverflow.com/questions/70354859","Anyway to work with Tensorflow in Mac with Apple Silicon (M1, M1 Pro, M1 Max) GPU?","2","<tensorflow><apple-silicon>","tensorflow"
"https://stackoverflow.com/questions/70434045","Need help in LSTM Autoencoder - Anomaly detection","2","<python><tensorflow><lstm><anomaly-detection>","tensorflow"
"https://stackoverflow.com/questions/69369087","Use tensor with numpy with eager execution turned off","2","<python><numpy><tensorflow>","tensorflow"
"https://stackoverflow.com/questions/63875542","tensorflow, Remove empty element from a ragged tensor","2","<tensorflow><tensorflow2.0>","tensorflow"
"https://stackoverflow.com/questions/68450845","Loss function for binary classification with problem of data imbalance","2","<tensorflow><image-segmentation><loss-function><semantic-segmentation><imbalanced-data>","tensorflow"
"https://stackoverflow.com/questions/65900848","Tensorflow Warning every time I import it - 'cudart64_101.dll not found'. Is there a way to get rid of only this warning?","2","<python><tensorflow>","tensorflow"
"https://stackoverflow.com/questions/63644124","Number of nodes in output later greater than number of classes in a neural network","2","<tensorflow><neural-network><classification>","tensorflow"
"https://stackoverflow.com/questions/64692942","Use TPU in Google Colab","2","<python><tensorflow><google-colaboratory><tpu>","tensorflow"
"https://stackoverflow.com/questions/68429691","Error: pixels passed to tf.browser.fromPixels() must be either an HTMLImageElement","2","<javascript><angular><tensor><tensorflow.js><tensorflowjs-converter>","tensorflow"
"https://stackoverflow.com/questions/65530024","tensorflow.js bodypix model not working and not giving any error","2","<javascript><image><image-segmentation><tensorflow.js><bodypix>","tensorflow"
"https://stackoverflow.com/questions/63581973","Keep same dataset augmentation for input and output in Tensorflow","2","<python><tensorflow><image-processing><autoencoder><data-augmentation>","tensorflow"
"https://stackoverflow.com/questions/65281710","Convergence issue with multi linear regression problems","2","<tensorflow><neural-network><linear-regression><convergence><multicollinearity>","tensorflow"
"https://stackoverflow.com/questions/66623226","New Tensorflow 2.4 GPU issues","2","<python><tensorflow><gpu><ubuntu-20.04>","tensorflow"
"https://stackoverflow.com/questions/65498670","Expected a TensorFlow computation, found intrinsic","2","<python><tensorflow><machine-learning><tensorflow-federated><federated-learning>","tensorflow"
"https://stackoverflow.com/questions/65200697","Tensorflow Custom Regularization Term comparing the Prediction to the True value","2","<python><tensorflow><machine-learning><conv-neural-network><loss-function>","tensorflow"
"https://stackoverflow.com/questions/69432329","Test Intel Low Precision Optimization Tool using dummy dataset","2","<tensorflow2.0><intel><intel-lpot>","tensorflow"
"https://stackoverflow.com/questions/65957329","problem with importing @tensorflow/tfjs-node while working with face-api.js package (node.js)","2","<javascript><node.js><tensorflow><face-recognition><face-api>","tensorflow"
"https://stackoverflow.com/questions/72314802","Tensor split to dynamic length tensors based on continuous mask values in tensorflow?","2","<python><tensorflow>","tensorflow"
"https://stackoverflow.com/questions/65229771","Tensorflow example works fine on colab, but gives nan while running on jupyter lab","2","<python><tensorflow><google-colaboratory><jupyter-lab>","tensorflow"
"https://stackoverflow.com/questions/66141239","Invalid argument:Not enough time for target transition sequence","2","<python><tensorflow><ctc>","tensorflow"
"https://stackoverflow.com/questions/65913108","`tape` is required when a `Tensor` loss is passed","2","<tensorflow>","tensorflow"
"https://stackoverflow.com/questions/72360428","tf.GradientTape giving None gradient while writing custom training loop","2","<python><tensorflow><gradient-descent><gradienttape>","tensorflow"
"https://stackoverflow.com/questions/65745098","compare entire row and column in numpy array and delete selected rows and columns","2","<python><arrays><numpy><tensorflow>","tensorflow"
"https://stackoverflow.com/questions/69364684","Why some of the hidden units return zero in the GRU autoencoder?","2","<tensorflow><deep-learning><lstm><recurrent-neural-network><autoencoder>","tensorflow"
"https://stackoverflow.com/questions/65932242","What is the meaning and purpose of the Linux /dev/ipu* device names for graphcore IPUs?","2","<docker><tensorflow><ipu><popart><poplar>","tensorflow"
"https://stackoverflow.com/questions/70437519","Python code failed in Azure ML Experiments but runs in conda environment","2","<python><azure><tensorflow><conda><ml-studio>","tensorflow"
"https://stackoverflow.com/questions/68685712","Tensorflow < 2.4 chip M1","2","<python><tensorflow><apple-m1><tensorflow2.x>","tensorflow"
"https://stackoverflow.com/questions/64483632","convert prediction tensor to an image","2","<javascript><tensorflow><tensorflow.js>","tensorflow"
"https://stackoverflow.com/questions/73966797","TensorFlow error on custom loss function: ValueError: No gradients provided for any variable","2","<python-3.x><tensorflow2.0><valueerror><loss-function>","tensorflow"
"https://stackoverflow.com/questions/72122939","`ResourceExhaustedError: Graph execution error` when trying to train tensorflow model using model.fit()","2","<python><tensorflow><google-colaboratory>","tensorflow"
"https://stackoverflow.com/questions/63719424","Understanding of SparsityParameters in tensorflow lite schema","2","<tensorflow><flatbuffers><tensorflow-lite>","tensorflow"
"https://stackoverflow.com/questions/63150553","couldn't find tensorflow version","2","<python><python-3.x><tensorflow>","tensorflow"
"https://stackoverflow.com/questions/69107300","Get access token from google.oauth2.Credentials","2","<python><google-cloud-platform><google-oauth><tensorflow-serving>","tensorflow"
"https://stackoverflow.com/questions/71238448","lstm different input and output shape","2","<tensorflow><tensorflow.js>","tensorflow"
"https://stackoverflow.com/questions/70203723","Use GPU in VSCode for tensorflow","2","<tensorflow><visual-studio-code>","tensorflow"
"https://stackoverflow.com/questions/63421764","Tensorflow-gpu not detecting GPU?","2","<python-3.x><tensorflow><gpu>","tensorflow"
"https://stackoverflow.com/questions/63318792","Filter Tensorflow dataset by Class","2","<python><tensorflow><tensorflow-datasets>","tensorflow"
"https://stackoverflow.com/questions/71330639","splitting the data into training and testing in federated learning","2","<python><tensorflow><tensorflow-datasets><tensorflow-federated>","tensorflow"
"https://stackoverflow.com/questions/63406460","Why is my model overfitting on the second epoch?","2","<python><tensorflow><deep-learning><transfer-learning><image-classification>","tensorflow"
"https://stackoverflow.com/questions/63454364","Confusion about the parameter in tf.estimator.Estimator","2","<python><tensorflow><tensorflow2.x>","tensorflow"
"https://stackoverflow.com/questions/65471612","'tensorflow_federated' has no attribute 'NamedTupleType","2","<python><tensorflow><tensorflow-federated><federated-learning>","tensorflow"
"https://stackoverflow.com/questions/68947062","This object does not have an attribute named ""this_rds_cluster_master_username""","2","<amazon-web-services><tensorflow><terraform><amazon-rds><amazon-aurora>","tensorflow"
"https://stackoverflow.com/questions/63408505","Using tensorboard with a DQN algorithm","2","<tensorflow><tensorboard><reinforcement-learning><dqn>","tensorflow"
"https://stackoverflow.com/questions/63537430","the asterisk in tf.gather_nd in python2.7 rise syntax error","2","<python><python-2.7><tensorflow>","tensorflow"
"https://stackoverflow.com/questions/71289273","TFF: train_test_client_split to partition each client data","2","<python><tensorflow><machine-learning><tensorflow-datasets><tensorflow-federated>","tensorflow"
"https://stackoverflow.com/questions/74103447","Get the neural network weights out of a Tensorflow `Graph`","2","<python><tensorflow><neural-network><reinforcement-learning><rllib>","tensorflow"
