QuestionLink,Title,Score,Tags,
"https://stackoverflow.com/questions/73250313","Getting error:([WinError 123] The filename, directory name, or volume label syntax is incorrect: '//') while training custom dataset through mask rcnn","2","<python><tensorflow>","tensorflow"
"https://stackoverflow.com/questions/67848459","TF2 code 10 times slower than equivalent PyTorch code for a Conv1D network","2","<tensorflow><tensorflow2.0>","tensorflow"
"https://stackoverflow.com/questions/72508268","Error while importing tf_agents in google colab","2","<python><tensorflow><machine-learning><google-colaboratory><tf-agent>","tensorflow"
"https://stackoverflow.com/questions/70980642","Python Tensorflow Dataset Filter Set .issubset()","2","<python><tensorflow><set><tensorflow-datasets>","tensorflow"
"https://stackoverflow.com/questions/73030630","Why class_weights doesn't work and error appear?","2","<python><tensorflow>","tensorflow"
"https://stackoverflow.com/questions/67611744","Calculate cosine similarity for elmo model","2","<python><tensorflow><word-embedding><elmo>","tensorflow"
"https://stackoverflow.com/questions/73107793","BERT pre-training from scratch with tensorflow version 2.x","2","<python><tensorflow><bert-language-model><tpu>","tensorflow"
"https://stackoverflow.com/questions/71951333","Prepare data input for tensorflow from numpy and scipy.sparse","2","<python><numpy><tensorflow><scipy><tensorflow-datasets>","tensorflow"
"https://stackoverflow.com/questions/71597474","""No module"" after setting up jupyter kernel","2","<python><tensorflow><import><jupyter-notebook><anaconda>","tensorflow"
"https://stackoverflow.com/questions/66926704","why spawn_strategy=standalone in tensorflow's bazelrc?","2","<tensorflow><bazel>","tensorflow"
"https://stackoverflow.com/questions/69584579","Implementing Normalization Inside Tensorflow Model","2","<python><tensorflow><normalization>","tensorflow"
"https://stackoverflow.com/questions/64186378","Jupyter notebook tensorflow pandas plotting error","2","<python><pandas><dataframe><tensorflow><matplotlib>","tensorflow"
"https://stackoverflow.com/questions/71502808","'cannot compute Pack as input #1(zero-based) was expected to be a float tensor but is a int32 tensor [Op:Pack] name: packed'. Error with tf.squeeze","2","<python><tensorflow><matplotlib><machine-learning><tensorflow-datasets>","tensorflow"
"https://stackoverflow.com/questions/69454217","Op type not registered \'IO>BigQueryClient\' with BigQuery connector on AI platform","2","<tensorflow><google-cloud-ml><google-cloud-ai>","tensorflow"
"https://stackoverflow.com/questions/68233414","Serialize a tf.train.Dataset with Tensor features into a tfrecord file?","2","<python><numpy><tensorflow><tensorflow-datasets><tfrecord>","tensorflow"
"https://stackoverflow.com/questions/70615673","Use of tf.GradientTape() exhausts all the gpu memory, without it it doesn't matter","2","<tensorflow><gpu><tensorflow2.0><gradienttape>","tensorflow"
"https://stackoverflow.com/questions/67319297","Switch off the GPU in a running script in python","2","<python><tensorflow><cuda><gpu>","tensorflow"
"https://stackoverflow.com/questions/67483626","Setup Tensorflow 2.4 on Ubuntu 20.04 with GPU without sudo","2","<python><tensorflow><ubuntu><ubuntu-20.04>","tensorflow"
"https://stackoverflow.com/questions/67974689","Using CSV data as input to TensorFlow recommender","2","<python><pandas><tensorflow>","tensorflow"
"https://stackoverflow.com/questions/69536507","Understand relation between different tensorflow AdagradOptimizer APIs","2","<tensorflow><tensorflow2.0>","tensorflow"
"https://stackoverflow.com/questions/68045316","RBF Layer - difficulty in understanding","2","<python><tensorflow><machine-learning><deep-learning><neural-network>","tensorflow"
"https://stackoverflow.com/questions/67371219","Gradients do not exist for most convolution filters in subclassed model","2","<python><tensorflow><tensorflow2.0>","tensorflow"
"https://stackoverflow.com/questions/73795063","Update tensor value using `assign` function on tensor 2DIM","2","<python><tensorflow>","tensorflow"
"https://stackoverflow.com/questions/72538995","Input Layer Incompatible with Tensorflow 2D CNN","2","<python><tensorflow><machine-learning><deep-learning><conv-neural-network>","tensorflow"
"https://stackoverflow.com/questions/67224476","Tensorflow Input Dimension mismatch problem","2","<python><tensorflow>","tensorflow"
"https://stackoverflow.com/questions/66059593","MultiWorkerMirroredStrategy hangs after starting GRPC server","2","<tensorflow><gpu><distributed-computing><hpc><slurm>","tensorflow"
"https://stackoverflow.com/questions/73631817","Tensorflow: x - reduce_mean(x) has gradient 0","2","<python><tensorflow><derivative>","tensorflow"
"https://stackoverflow.com/questions/69549126","Tensorflow TypeError: Cannot convert 1e-12 to EagerTensor of dtype int32","2","<python><pandas><numpy><tensorflow><tensor>","tensorflow"
"https://stackoverflow.com/questions/73316883","While predicting on trained model I've getting an Image shape error","2","<python><tensorflow><deep-learning><image-resizing>","tensorflow"
"https://stackoverflow.com/questions/68044344","ValueError: Error when checking input: expected conv1d_29_input to have 3 dimensions, but got array with shape (150, 1320)","2","<python><tensorflow><conv-neural-network>","tensorflow"
"https://stackoverflow.com/questions/73403382","DNN library is not found. (Google Colab)","2","<tensorflow><google-colaboratory><cudnn>","tensorflow"
"https://stackoverflow.com/questions/72968794","ValueError: Input 0 of layer conv1d is incompatible with the layer: : expected min_ndim=3, found ndim=2","2","<python><tensorflow><time-series><conv1d>","tensorflow"
"https://stackoverflow.com/questions/69593105","tf_agents doesn't properly learn a simple environment","2","<python><tensorflow><reinforcement-learning><tensorflow-agents>","tensorflow"
"https://stackoverflow.com/questions/68122099","Tensorflow Lite inference for real time recognition","2","<python><tensorflow><raspberry-pi><real-time><tensorflow-lite>","tensorflow"
"https://stackoverflow.com/questions/75138443","Why is JAX jit needed for jax.numpy operations?","2","<jax><tensorflow-xla>","tensorflow"
"https://stackoverflow.com/questions/72975169","`PackagesNotFoundError: The following packages are not available from current channels`","2","<python><tensorflow><anaconda><conda>","tensorflow"
"https://stackoverflow.com/questions/75245826","C++ Tensorflow lite, undefined reference on some functions","2","<c++><tensorflow><cmake><makefile><tensorflow-lite>","tensorflow"
"https://stackoverflow.com/questions/74764831","Preprocessing layers with seed not producing the same data augmentation for images and masks","2","<tensorflow><data-augmentation><data-preprocessing><image-masking>","tensorflow"
"https://stackoverflow.com/questions/75252000","why does the list switch allow xcopy to work?","2","<python><tensorflow><path><7zip><xcopy>","tensorflow"
"https://stackoverflow.com/questions/73661935","Accuracy for every epoch is starting with 0 instead of 1","2","<python><tensorflow>","tensorflow"
"https://stackoverflow.com/questions/75329624","Unable to import tensorflow_probability.substrates.jax","2","<python><tensorflow><anaconda><jax><tensorflow-probability>","tensorflow"
"https://stackoverflow.com/questions/75647050","Append to a list in loop using tf.range","2","<python><tensorflow>","tensorflow"
"https://stackoverflow.com/questions/76050961","Mismatch in counting operations in tensorflow","2","<tensorflow>","tensorflow"
"https://stackoverflow.com/questions/73408350","Dropping dimension of Tensor with size bigger then one tensor, in Tensorflow","2","<python><tensorflow>","tensorflow"
"https://stackoverflow.com/questions/75264456","ValueError: Inputs have incompatible shapes","2","<python><tensorflow><deep-learning><image-segmentation>","tensorflow"
"https://stackoverflow.com/questions/73685542","Extract only a portion of a numpy array from tf.data","2","<python><numpy><tensorflow><deep-learning><tensorflow-datasets>","tensorflow"
"https://stackoverflow.com/questions/67251401","tflite converter error operation not supported","2","<tensorflow><adb><tensorflow-lite><bert-language-model>","tensorflow"
"https://stackoverflow.com/questions/67281969","Add TensorFlow and Numpy libraries to osgeo/gdal docker image","2","<python><docker><tensorflow><dockerfile><gdal>","tensorflow"
"https://stackoverflow.com/questions/75426868","TensorFlow GPU problem 'libnvinfer.so.7' and ' 'libnvinfer.so.7'' could not load","2","<python><tensorflow><gpu><lib>","tensorflow"
"https://stackoverflow.com/questions/74867671","When is the watch() function required in Tensorflow to enable tracking of gradients?","2","<python><tensorflow>","tensorflow"
"https://stackoverflow.com/questions/74875266","conda/mamba can't solve tensorflow_probability and tensorflow dependencies","2","<tensorflow><conda><miniconda><tensorflow-probability><mamba>","tensorflow"
"https://stackoverflow.com/questions/67332793","Tensorflow dataset interleave from_generator throws InvalidArgumentError","2","<tensorflow><tensorflow2.0>","tensorflow"
"https://stackoverflow.com/questions/68132431","Load Tensorflow Lite models in python","2","<python><tensorflow><tensorflow-lite>","tensorflow"
"https://stackoverflow.com/questions/69583960","Training fasttext word embedding on your own corpus","2","<python><tensorflow><gensim><word-embedding><fasttext>","tensorflow"
"https://stackoverflow.com/questions/71492567","tf.while_loop() in call() of custom layer in TensorFlow 2","2","<python><tensorflow>","tensorflow"
"https://stackoverflow.com/questions/68291540","tf.reduce_sum() unexpected result with uint8","2","<python><arrays><numpy><tensorflow><tensor>","tensorflow"
"https://stackoverflow.com/questions/74627040","Tensorflow dataset with variable number of elements","2","<python><image><tensorflow><dataset><ragged-tensors>","tensorflow"
"https://stackoverflow.com/questions/74841605","Error getting native address of native library: task_vision_jni_gms","2","<android><kotlin><tensorflow><tensorflow-lite>","tensorflow"
"https://stackoverflow.com/questions/71594268","Tensorboard not updating by batch in google colab","2","<tensorflow><google-colaboratory><tensorboard>","tensorflow"
"https://stackoverflow.com/questions/68353106","Why does the numpy dot product function returns an error when passed two TensorFlow Variable objects?","2","<python><numpy><tensorflow><matrix-multiplication>","tensorflow"
"https://stackoverflow.com/questions/70090817","'tensorflow._api.v2.experimental' has no attribute 'register_filesystem_plugin'","2","<python><tensorflow><tensorflow2.0><object-detection-api>","tensorflow"
"https://stackoverflow.com/questions/71799790","py_environment 'time_step' doesn't match 'time_step_spec' - but I can't spot the difference","2","<python><tensorflow><types><tf-agent>","tensorflow"
"https://stackoverflow.com/questions/76170494","Tensoflow 2.12.0 does not recognize tensorflow.compiler.xla.experimental","1","<python-3.x><tensorflow>","tensorflow"
"https://stackoverflow.com/questions/75316969","TensorFlow dataset with multi-dimensional Tensors from a CSV file","1","<tensorflow><tensor><tensorflow-datasets>","tensorflow"
"https://stackoverflow.com/questions/71719891","Compile errors in Tensorflow Lite Micro framework when trying to integrate Tensorflow Lite Micro to my ESP32 Arduino project","1","<c++><tensorflow><tensorflow-lite><esp32><arduino-esp32>","tensorflow"
"https://stackoverflow.com/questions/68357926","Implement CNN+LSTM Model to predict a video","1","<python><tensorflow><deep-learning>","tensorflow"
"https://stackoverflow.com/questions/76273083","Apply tf.ensure_shape for multiple outputs","1","<python-3.x><tensorflow><deep-learning><tensorflow2.0>","tensorflow"
"https://stackoverflow.com/questions/75338454","Azure Function dependencies - Invalid ELF header","1","<node.js><azure-functions><tensorflow.js>","tensorflow"
"https://stackoverflow.com/questions/75486794","Why is predict_on_batch is repeating the first output over and over?","1","<python><tensorflow><replit>","tensorflow"
"https://stackoverflow.com/questions/71598609","Item assignment in Tensorflow","1","<python><numpy><tensorflow>","tensorflow"
"https://stackoverflow.com/questions/76101948","TensorFlow GPU recognized in the terminal but not in the Jupyter notebook","1","<python><tensorflow><gpu>","tensorflow"
"https://stackoverflow.com/questions/75339130","Convert an array of 3D tensors to single 4D tensor","1","<python><tensorflow>","tensorflow"
"https://stackoverflow.com/questions/75737232","Loss is Nan for SegFormer vision transformer trained on BDD10k","1","<python><tensorflow><machine-learning><deep-learning><segformer>","tensorflow"
"https://stackoverflow.com/questions/71621950","JSONDecodeError: Expecting value: line 1 column 1 (char 0) on Raspberry Pi's Imager (GNU/Linux)","1","<python><tensorflow>","tensorflow"
"https://stackoverflow.com/questions/75916309","Using tf.data.Dataset prefetch makes model performance overfit?","1","<python><tensorflow><machine-learning><deep-learning><prefetch>","tensorflow"
"https://stackoverflow.com/questions/75356723","Tensorflow.data.Dataset.rejection_resample modifies my dataset's element_spec","1","<python><tensorflow><machine-learning><tensorflow-datasets>","tensorflow"
"https://stackoverflow.com/questions/75913753","ValueError: in user code: ValueError: No gradients provided for any variable for Autoencoder Tensorflow","1","<python><tensorflow><autoencoder>","tensorflow"
"https://stackoverflow.com/questions/71709493","ModuleNotFoundError: No module named 'tensorflow.examples' (i am just tried to load mnist)","1","<python><tensorflow><deep-learning><neural-network>","tensorflow"
"https://stackoverflow.com/questions/75916396","TensorFlow Prediction for each image in a folder","1","<python><tensorflow><conv-neural-network><image-recognition>","tensorflow"
"https://stackoverflow.com/questions/75400035","What does it mean to have more neurons than bits in the input layer in TensorFlow?","1","<tensorflow><neural-network><tensorflow2.0>","tensorflow"
"https://stackoverflow.com/questions/75932501","model.parameters() alternative for TransUNet from transunet python library","1","<python><tensorflow><machine-learning><deep-learning><unet-neural-network>","tensorflow"
"https://stackoverflow.com/questions/71793792","test tensorflow program yielding very low accuracies","1","<python><tensorflow><deep-learning>","tensorflow"
"https://stackoverflow.com/questions/71705218","Bert prediction shape not equal to num_samples","1","<python><tensorflow><tensorflow-datasets><bert-language-model><transformer-model>","tensorflow"
"https://stackoverflow.com/questions/75409992","TensorFlow.js tf.multinomial unexpected result [62083, 37917] instead of [75000, 25000]","1","<javascript><node.js><tensorflow><multinomial>","tensorflow"
"https://stackoverflow.com/questions/76016645","Tensorflow 2.12 - Could not load library libcudnn_cnn_infer.so.8 in WSL2","1","<python-3.x><tensorflow><miniconda><cudnn>","tensorflow"
"https://stackoverflow.com/questions/74850480","Running tensorflow-macos 2.11.0 give runtime error on Apple Mac M1","1","<python><tensorflow>","tensorflow"
"https://stackoverflow.com/questions/71737199","Stitching patches of Image together","1","<python><tensorflow><image-processing><tensorflow2.0>","tensorflow"
"https://stackoverflow.com/questions/75424120","Tensorflow Nvidia GPU not detected","1","<python><tensorflow><gpu>","tensorflow"
"https://stackoverflow.com/questions/75255983","Weird behaviour in tensorflow metric","1","<python><python-3.x><tensorflow><tensorflow2.0>","tensorflow"
"https://stackoverflow.com/questions/74691080","List comprehension in keras custom loss function","1","<python><tensorflow><machine-learning><deep-learning>","tensorflow"
"https://stackoverflow.com/questions/71748635","Jupyter kernel with TensorFlow GPU","1","<python><tensorflow><jupyter-notebook>","tensorflow"
"https://stackoverflow.com/questions/75732216","Low FPS when using deepsort and yolov3 with GPU","1","<tensorflow><gpu><yolo>","tensorflow"
"https://stackoverflow.com/questions/72710792","Creating Pearson Correlation metrics using Tensorflow Tensor","1","<tensorflow><deep-learning><metrics><tensor><pearson-correlation>","tensorflow"
"https://stackoverflow.com/questions/72601409","In GAN network, I got error while trying to transform tensorflow dataset's to range [-1,1]","1","<python><tensorflow><machine-learning><deep-learning><computer-vision>","tensorflow"
"https://stackoverflow.com/questions/74581239","Can't convert Python list to Tensorflow Dataset (InvalidArgumentError: Shapes of all inputs must match...)","1","<python-3.x><tensorflow>","tensorflow"
"https://stackoverflow.com/questions/75743490","Adding a new layer to a stax.serial object","1","<python><tensorflow><deep-learning><neural-network><jax>","tensorflow"
"https://stackoverflow.com/questions/72749893","Optimizer.apply_gradients creating variables in tf.function","1","<python><tensorflow><computer-vision>","tensorflow"
"https://stackoverflow.com/questions/74602575","Tensorflow dataset group by string key","1","<python><tensorflow><group-by><hashmap><tensorflow-datasets>","tensorflow"
"https://stackoverflow.com/questions/74685350","Converting Numpy text array to tf.data.Dataset","1","<python><python-3.x><tensorflow><tensorflow2.0><tensorflow-datasets>","tensorflow"
"https://stackoverflow.com/questions/75759597","TypeError: isinstance() arg 2 must be a type or tuple of types in tensorflow_addons RSquare","1","<python><tensorflow><regression>","tensorflow"
"https://stackoverflow.com/questions/74662833","Tensorflow.js model works on google teachable machine but not on react native app","1","<react-native><machine-learning><tensorflow.js>","tensorflow"
"https://stackoverflow.com/questions/74610068","Tensorflow Multi Head Attention on Inputs: 4 x 5 x 20 x 64 with attention_axes=2 throwing mask dimension error (tf 2.11.0)","1","<python><python-3.x><tensorflow><attention-model><self-attention>","tensorflow"
"https://stackoverflow.com/questions/74685360","Paddle OCR gives ""device id must be less than GPU count"" error","1","<python><tensorflow><ocr><paddleocr>","tensorflow"
"https://stackoverflow.com/questions/75792711","Reshape tensors of unknown shape with tf.function","1","<python><tensorflow>","tensorflow"
"https://stackoverflow.com/questions/74689845","Why did it happen ""AttributeError: 'matrix' object has no attribute 'todense'""","1","<python><image><numpy><tensorflow><conv-neural-network>","tensorflow"
"https://stackoverflow.com/questions/68319579","tfa.optimizers.MultiOptimizer - TypeError: 'Not JSON Serializable:'","1","<json><tensorflow><serialization><tensorflow2.0>","tensorflow"
"https://stackoverflow.com/questions/74787251","TensorFlow display progress while iterating dataset","1","<python><tensorflow><dataset><pipeline><data-preprocessing>","tensorflow"
"https://stackoverflow.com/questions/75918731","why predict with a tensorflow model don't give the same answer for each signal separatly and all signal at once?","1","<python><tensorflow><predict>","tensorflow"
"https://stackoverflow.com/questions/74836151","nothing provides __cuda needed by tensorflow-2.10.0-cuda112py310he87a039_0","1","<python><tensorflow><conda><mamba><mambaforge>","tensorflow"
"https://stackoverflow.com/questions/68339171","Create a tensor inside an autographable function based on input tensor's shape","1","<python><tensorflow>","tensorflow"
"https://stackoverflow.com/questions/74972912","Load my model from tensorflow but not work","1","<python><tensorflow><machine-learning>","tensorflow"
"https://stackoverflow.com/questions/75931260","UnicodeDecodeError when trying to make a dataset with image_dataset_from_directory","1","<image><tensorflow2.0><tensorflow-datasets>","tensorflow"
"https://stackoverflow.com/questions/74916319","Why my TensorFlow model is not changing their space after training?","1","<python><tensorflow>","tensorflow"
"https://stackoverflow.com/questions/68254238","construct your `Model` instance in graph mode or call `Model.predict` with eager mode enabled","1","<python><tensorflow>","tensorflow"
"https://stackoverflow.com/questions/75144091","jax automatic differentiation","1","<python><tensorflow><jax><automatic-differentiation>","tensorflow"
"https://stackoverflow.com/questions/75941954","Input shape for functional Tensorflow api","1","<python><tensorflow>","tensorflow"
"https://stackoverflow.com/questions/74977873","the evaluation section leds to bug","1","<tensorflow><google-colaboratory><transformer-model>","tensorflow"
"https://stackoverflow.com/questions/71590479","GradientTape returning None when run in a loop","1","<python><tensorflow><autograd>","tensorflow"
"https://stackoverflow.com/questions/75323248","Will cmake compiled TFLite work on android?","1","<android><c++><tensorflow><cmake><android-ndk>","tensorflow"
"https://stackoverflow.com/questions/76043027","Load Python Tensorflow saved_model with Tensorflow.js","1","<python><tensorflow><tensorflow.js><tensorflowjs-converter>","tensorflow"
"https://stackoverflow.com/questions/75031433","tf.io.GFile with Tensor String Input","1","<python><tensorflow>","tensorflow"
"https://stackoverflow.com/questions/68156055","Swap elements between two tensors in Tensorflow","1","<python><numpy><tensorflow>","tensorflow"
"https://stackoverflow.com/questions/75734650","Curve fitting a Gaussian data using TensorFlow","1","<python><tensorflow><machine-learning><curve-fitting><tensorflow-lite>","tensorflow"
"https://stackoverflow.com/questions/74923466","Rotate a jpg with tensorflow.js","1","<javascript><tensorflow><tensorflow.js>","tensorflow"
"https://stackoverflow.com/questions/73511663","filter dataset by label in tensorflow","1","<python><tensorflow><filter><tensorflow-datasets>","tensorflow"
"https://stackoverflow.com/questions/68171714","What changes occur when using tf_agents.environments.TFPyEnvironment to convert a Python RL environment into a TF environment?","1","<python-3.x><tensorflow><tensorflow-agents>","tensorflow"
"https://stackoverflow.com/questions/68170720","Tiff workaround for Tensorflow","1","<python><tensorflow><tiff>","tensorflow"
"https://stackoverflow.com/questions/75011964","saving weights of a tensorflow model in Databricks","1","<tensorflow><databricks><huggingface-transformers>","tensorflow"
"https://stackoverflow.com/questions/73631729","NotImplementedError:: Cannot convert a symbolic Tensor (bidirectional/forward_lstm/strided_slice:0) to a numpy array","1","<tensorflow2.0>","tensorflow"
"https://stackoverflow.com/questions/67980752","tf.nn.conv2d occurs InvalidArgumentError: Value for attr 'T' of uint8 is not in the list of allowed values","1","<python-3.x><tensorflow>","tensorflow"
"https://stackoverflow.com/questions/68125189","InvalidArgumentError: Input to reshape is a tensor with 7872512 values, but the requested shape requires a multiple of 6400","1","<python><tensorflow><machine-learning><deep-learning><conv-neural-network>","tensorflow"
"https://stackoverflow.com/questions/75179849","tensorflow backpropagation with all variables without updating non-trainable variables","1","<tensorflow>","tensorflow"
"https://stackoverflow.com/questions/73361613","Tensorflow define lossfunction","1","<python><tensorflow><loss-function>","tensorflow"
"https://stackoverflow.com/questions/68038676","TypeError: 'retval_' has dtype int32 in the main branch, but dtype float32 in the else branch","1","<python><tensorflow><deep-learning><typeerror><multilabel-classification>","tensorflow"
"https://stackoverflow.com/questions/68029803","Why the output of model.predict() is undefined?","1","<javascript><node.js><tensorflow><tensorflow.js>","tensorflow"
"https://stackoverflow.com/questions/68272345","Hidden file in my training dataset which makes tensorflow return ""Unknown image file format. One of JPEG, PNG, GIF, BMP required.""","1","<python><file><operating-system><tensorflow2.0><hidden-files>","tensorflow"
"https://stackoverflow.com/questions/73659953","Training fails if model is saved beforehand","1","<python><tensorflow>","tensorflow"
"https://stackoverflow.com/questions/68054694","Input 0 of layer sequential is incompatible with the layer: expected axis -1 of input shape to have value 3 but received input with shape","1","<python><tensorflow><machine-learning><model><predict>","tensorflow"
"https://stackoverflow.com/questions/68329513","I want to add more data to a existing tensorflow model","1","<python><tensorflow><jupyter-notebook>","tensorflow"
"https://stackoverflow.com/questions/68361071","Multiply outputs from two Conv2D layers in TensorFlow 2+","1","<python><tensorflow><machine-learning><computer-vision><tensorflow2.0>","tensorflow"
"https://stackoverflow.com/questions/73693819","Removal of data /indices values(range) from a tensor tensorflow","1","<python><tensorflow><slice>","tensorflow"
"https://stackoverflow.com/questions/68121006","Why are these Gradient Accumulation implementations not working?","1","<tensorflow>","tensorflow"
"https://stackoverflow.com/questions/71604825","DatasetNotFoundError: Dataset bee_dataset not found","1","<python><tensorflow><tensorflow-datasets>","tensorflow"
"https://stackoverflow.com/questions/71522857","Get Variable from SageMaker Script Processor","1","<python><docker><tensorflow2.0><amazon-sagemaker>","tensorflow"
"https://stackoverflow.com/questions/73753452","Convert Tensor of hex strings to int","1","<python><tensorflow><hex>","tensorflow"
"https://stackoverflow.com/questions/68121139","Adapting Tensorflow2 code - simulating a reaction-diffusion soliton to include 3 velocity fields","1","<python><python-3.x><tensorflow><physics><velocity>","tensorflow"
